name;price;unit_price;ean;nutriscore;promo;url
;2,39 €;;3033491485763;;;https://www.carrefour.fr/p/yaourt-a-boire-vanille-cookie-proteine-0-mg-hipro-3033491485763
Skyr protéiné nature 0% MG YOPLAIT;2,19 €;5.48 € / KG;3329770073265;A;Ouvrir description de la promotion Le 2ème à -60%;https://www.carrefour.fr/p/skyr-proteine-nature-0-mg-yoplait-3329770073265?t=36993
Lait vitaminé Viva CANDIA;6,90 €;1.15 € / L;3176571991003;;;https://www.carrefour.fr/p/lait-vitamine-viva-candia-3176571991003
Skyr protéiné sur lit de fruits rouges 0% MG YOPLAIT;2,25 €;5.62 € / KG;3329770073272;A;Ouvrir description de la promotion Le 2ème à -60%;https://www.carrefour.fr/p/skyr-proteine-sur-lit-de-fruits-rouges-0-mg-yoplait-3329770073272?t=36993
Skyr protéiné nature 0% MG YOPLAIT;3,39 €;3.99 € / KG;3329770077003;A;Ouvrir description de la promotion Le 2ème à -60%;https://www.carrefour.fr/p/skyr-proteine-nature-0-mg-yoplait-3329770077003?t=36993
Beaufort AOP;6,58 €;32.90 € / KG;3294583173177;;;https://www.carrefour.fr/p/beaufort-aop-3294583173177?t=36993
Beaufort AOP;6,58 €;32.90 € / KG;3294583173207;U;;https://www.carrefour.fr/p/beaufort-aop-3294583173207?t=36993
Beaufort AOP;6,58 €;32.90 € / U;3523680403598;;;https://www.carrefour.fr/p/beaufort-aop-3523680403598?t=36993
Yaourts à boire saveur vanille ACTIMEL;3,56 €;3.56 € / KG;3033491988202;;Ouvrir description de la promotion Le 2ème à -60%;https://www.carrefour.fr/p/yaourts-a-boire-saveur-vanille-actimel-3033491988202
Fromage Beaufort AOP;6,58 €;32.90 € / KG;3276551823864;;;https://www.carrefour.fr/p/fromage-beaufort-aop-3276551823864?t=36993
Fromage Beaufort AOP;6,58 €;32.90 € / KG;3276555430266;;;https://www.carrefour.fr/p/fromage-beaufort-aop-3276555430266?t=36993
Fromage Râpé Emmental ENTREMONT;3,73 €;7.46 € / KG;3123930715008;D;Ouvrir description de la promotion PROMO : 34%;https://www.carrefour.fr/p/fromage-rape-emmental-entremont-3123930715008?t=36993
Yaourts à boire fraise banane ACTIMEL;3,56 €;3.56 € / KG;3033491987915;;Ouvrir description de la promotion Le 2ème à -60%;https://www.carrefour.fr/p/yaourts-a-boire-fraise-banane-actimel-3033491987915
Œufs frais de poules élevées au sol de poules élevées au sol CARREFOUR CLASSIC';2,99 €;0.25 € / U;3560071098285;A;Ouvrir description de la promotion Le 2ème à -30%;https://www.carrefour.fr/p/oeufs-frais-de-poules-elevees-au-sol-de-poules-elevees-au-sol-carrefour-classic-3560071098285?t=36993
Beurre Doux Gastronomique PRESIDENT;5,69 €;11.38 € / KG;3155251207740;U;Ouvrir description de la promotion Le 2ème à -50%;https://www.carrefour.fr/p/beurre-doux-gastronomique-president-3155251207740?t=36993
Yaourt aux fruits mixés fraise framboise pêche abricot DANONE VELOUTE;3,89 €;2.59 € / KG;3033491579752;;;https://www.carrefour.fr/p/yaourt-aux-fruits-mixes-fraise-framboise-peche-abricot-danone-veloute-3033491579752
Fromage Enfant Goûter Mini BABYBEL;4,35 €;16.48 € / KG;3073781178005;;Ouvrir description de la promotion Le 2ème à -60%;https://www.carrefour.fr/p/fromage-enfant-gouter-mini-babybel-3073781178005?t=36993
Œufs bio moyen CARREFOUR BIO;3,59 €;0.36 € / U;3245412846991;A;Ouvrir description de la promotion 2 achetés = 6,6€;https://www.carrefour.fr/p/oeufs-bio-moyen-carrefour-bio-3245412846991?t=36993
Lait Aux 10 Vitamines CANDIA;10,98 €;1.37 € / L;3533631905576;U;Ouvrir description de la promotion Le 2ème à -50%;https://www.carrefour.fr/p/lait-aux-10-vitamines-candia-3533631905576?t=36993
Emmental râpé fondant CARREFOUR CLASSIC';4,09 €;8.18 € / KG;3270190207689;C;Ouvrir description de la promotion 2 achetés = 7,78€;https://www.carrefour.fr/p/emmental-rape-fondant-carrefour-classic-3270190207689?t=36993
Camembert Le Caractère CARREFOUR;1,85 €;7.40 € / KG;3560071082444;D;-15% MARDI PASS;https://www.carrefour.fr/p/camembert-le-caractere-carrefour-3560071082444?t=36993
Cheddar CARREFOUR;4,75 €;15.83 € / KG;3560070251216;D;-15% MARDI PASS;https://www.carrefour.fr/p/cheddar-carrefour-3560070251216?t=36993
Yaourts nature DANONE;0,99 €;1.98 € / KG;3033490004521;;;https://www.carrefour.fr/p/yaourts-nature-danone-3033490004521
Compote Pomme CARREFOUR;1,69 €;2.11 € / KG;3245412730764;A;-15% MARDI PASS;https://www.carrefour.fr/p/compote-pomme-carrefour-3245412730764?t=36993
Compote Pomme Poire CARREFOUR;1,09 €;2.72 € / KG;3245412730870;A;-15% MARDI PASS;https://www.carrefour.fr/p/compote-pomme-poire-carrefour-3245412730870?t=36993
Compote Pomme Fraise CARREFOUR;1,09 €;2.72 € / KG;3245412730917;A;-15% MARDI PASS;https://www.carrefour.fr/p/compote-pomme-fraise-carrefour-3245412730917?t=36993
Compote Pomme Abricot CARREFOUR;1,09 €;2.72 € / KG;3245412730924;A;-15% MARDI PASS;https://www.carrefour.fr/p/compote-pomme-abricot-carrefour-3245412730924?t=36993
Coulommiers de Caractére Onctueux CARREFOUR;2,69 €;7.69 € / KG;3560070275878;D;-15% MARDI PASS;https://www.carrefour.fr/p/coulommiers-de-caractere-onctueux-carrefour-3560070275878?t=36993
Crème Semi-Épaisse Légère 18% Mat.Gr. CARREFOUR;2,49 €;4.98 € / L;3560070814602;D;-15% MARDI PASS;https://www.carrefour.fr/p/creme-semi-epaisse-legere-18-mat-gr-carrefour-3560070814602?t=36993
Cottage cheese fromage frais salé DANONE;2,39 €;11.95 € / KG;3033491922466;;;https://www.carrefour.fr/p/cottage-cheese-fromage-frais-sale-danone-3033491922466
Crème Fluide Légère 12% Mat.Gr. CARREFOUR;1,65 €;4.12 € / L;3560071028374;D;-15% MARDI PASS;https://www.carrefour.fr/p/creme-fluide-legere-12-mat-gr-carrefour-3560071028374?t=36993
Crème Anglaise CARREFOUR;1,35 €;2.70 € / L;3560070423163;B;-15% MARDI PASS;https://www.carrefour.fr/p/creme-anglaise-carrefour-3560070423163?t=36993
Crème dessert café CARREFOUR;0,91 €;1.82 € / KG;3270190024446;;-15% MARDI PASS;https://www.carrefour.fr/p/creme-dessert-cafe-carrefour-3270190024446?t=36993
Crème dessert saveur praliné CARREFOUR;0,91 €;1.82 € / KG;3560070884728;;-15% MARDI PASS;https://www.carrefour.fr/p/creme-dessert-saveur-praline-carrefour-3560070884728?t=36993
Crème Fraîche Entière Epaisse 30% Mat.Gr. CARREFOUR;0,95 €;4.75 € / L;3270190020998;D;-15% MARDI PASS;https://www.carrefour.fr/p/creme-fraiche-entiere-epaisse-30-mat-gr-carrefour-3270190020998?t=36993
Crème Fraîche Légère 15% Mat.Gr. CARREFOUR;1,29 €;2.58 € / L;3560070349647;D;;https://www.carrefour.fr/p/creme-fraiche-legere-15-mat-gr-carrefour-3560070349647?t=36993
Crème Fraîche Epaisse 30% Mat.Gr. CARREFOUR;1,89 €;3.78 € / L;3560070349692;D;;https://www.carrefour.fr/p/creme-fraiche-epaisse-30-mat-gr-carrefour-3560070349692?t=36993
Dessert Dessert lacté au chocolat et aromatisé CARREFOUR;1,35 €;4.22 € / KG;3270190216797;C;-15% MARDI PASS;https://www.carrefour.fr/p/dessert-dessert-lacte-au-chocolat-et-aromatise-carrefour-3270190216797?t=36993
dessert au café avec pépites de chocolat café cappuccino CARREFOUR;3,75 €;10.42 € / KG;3560071544164;D;Ouvrir description de la promotion Le 2ème à -30%;https://www.carrefour.fr/p/dessert-au-cafe-avec-pepites-de-chocolat-cafe-cappuccino-carrefour-3560071544164?t=36993
Faisselle nature 6% MG CARREFOUR;1,79 €;4.48 € / KG;3245412925344;C;-15% MARDI PASS;https://www.carrefour.fr/p/faisselle-nature-6-mg-carrefour-3245412925344?t=36993
Flan chocolat CARREFOUR;2,25 €;2.81 € / KG;3560070777792;C;-15% MARDI PASS;https://www.carrefour.fr/p/flan-chocolat-carrefour-3560070777792?t=36993
Fromage à Tartiner Nature CARREFOUR;1,29 €;8.60 € / KG;3245411216818;D;-15% MARDI PASS;https://www.carrefour.fr/p/fromage-a-tartiner-nature-carrefour-3245411216818?t=36993
Fromage La Brique Fondante Et Crémeuse CARREFOUR;1,89 €;9.45 € / KG;3245411692834;D;-15% MARDI PASS;https://www.carrefour.fr/p/fromage-la-brique-fondante-et-cremeuse-carrefour-3245411692834?t=36993
Crème dessert chocolat NESQUIK;1,69 €;4.69 € / KG;3023290007310;;;https://www.carrefour.fr/p/creme-dessert-chocolat-nesquik-3023290007310
Fromage Cœur Complice CARREFOUR;1,99 €;9.95 € / KG;3270190021261;;-15% MARDI PASS;https://www.carrefour.fr/p/fromage-coeur-complice-carrefour-3270190021261?t=36993
Fromage Le Pavé Ocre CARREFOUR;2,39 €;10.86 € / KG;3270190026082;D;-15% MARDI PASS;https://www.carrefour.fr/p/fromage-le-pave-ocre-carrefour-3270190026082?t=36993
Fromage Parmigiano Reggiano AOP 30 mois d'affinage CARREFOUR;5,52 €;34.50 € / KG;3276559943687;;;https://www.carrefour.fr/p/fromage-parmigiano-reggiano-aop-30-mois-d-affinage-carrefour-3276559943687?t=36993
Yaourt aromatisé sur lit de fraise pêche mangue passion framboise PERLE DE LAIT YOPLAIT;3,89 €;3.89 € / KG;3329770079243;;;https://www.carrefour.fr/p/yaourt-aromatise-sur-lit-de-fraise-peche-mangue-passion-framboise-perle-de-lait-yoplait-3329770079243
Fromage tartiflette CARREFOUR;3,89 €;7.78 € / KG;3560070252114;D;-15% MARDI PASS;https://www.carrefour.fr/p/fromage-tartiflette-carrefour-3560070252114?t=36993
Fromage de Chèvre Au Lait de Vache et de Chévre CARREFOUR;1,69 €;9.39 € / KG;3560070530564;D;;https://www.carrefour.fr/p/fromage-de-chevre-au-lait-de-vache-et-de-chevre-carrefour-3560070530564?t=36993
Fromage en Tranches à Raclette classique CARREFOUR;5,65 €;11.77 € / KG;3560070753833;D;Ouvrir description de la promotion Le 2ème à -30%;https://www.carrefour.fr/p/fromage-en-tranches-a-raclette-classique-carrefour-3560070753833?t=36993
Fromage en Tranches à Raclette 3 Poivres CARREFOUR;3,75 €;15.00 € / KG;3560070753925;D;Ouvrir description de la promotion Le 2ème à -30%;https://www.carrefour.fr/p/fromage-en-tranches-a-raclette-3-poivres-carrefour-3560070753925?t=36993
Fromage en Tranches à Raclette Au Lait Entier CARREFOUR;4,19 €;11.97 € / KG;3560070818105;;Ouvrir description de la promotion Le 2ème à -30%;https://www.carrefour.fr/p/fromage-en-tranches-a-raclette-au-lait-entier-carrefour-3560070818105?t=36993
Yaourt aux fruits mixés pêche mangue abricot DANONE VELOUTE;2,69 €;2.69 € / KG;3033491579745;;;https://www.carrefour.fr/p/yaourt-aux-fruits-mixes-peche-mangue-abricot-danone-veloute-3033491579745
Fromage Le Tendre Créme CARREFOUR;2,35 €;9.40 € / KG;3560070851683;D;-15% MARDI PASS;https://www.carrefour.fr/p/fromage-le-tendre-creme-carrefour-3560070851683?t=36993
Fromage de Brebis CARREFOUR;1,85 €;18.50 € / KG;3560070899869;;-15% MARDI PASS;https://www.carrefour.fr/p/fromage-de-brebis-carrefour-3560070899869?t=36993
Fromage en Tranches à Raclette Classique Et 3 Poivres CARREFOUR;5,59 €;13.98 € / KG;3560070910571;D;Ouvrir description de la promotion Le 2ème à -30%;https://www.carrefour.fr/p/fromage-en-tranches-a-raclette-classique-et-3-poivres-carrefour-3560070910571?t=36993
Yaourts nature DANONE;1,95 €;1.95 € / KG;3033490004514;;;https://www.carrefour.fr/p/yaourts-nature-danone-3033490004514
Fromage en Tranches à Raclette Fumée CARREFOUR;3,79 €;15.16 € / KG;3560070910601;D;Ouvrir description de la promotion Le 2ème à -30%;https://www.carrefour.fr/p/fromage-en-tranches-a-raclette-fumee-carrefour-3560070910601?t=36993
Fromage en Tranches à Raclette : 3 Poivres,Classique,Fumée Sans Croûte CARREFOUR;8,35 €;13.92 € / KG;3560070910786;D;Ouvrir description de la promotion Le 2ème à -30%;https://www.carrefour.fr/p/fromage-en-tranches-a-raclette-3-poivres-classique-fumee-sans-croute-carrefour-3560070910786?t=36993
Fromage de Chèvre CARREFOUR;2,29 €;11.45 € / KG;3560070927357;;-15% MARDI PASS;https://www.carrefour.fr/p/fromage-de-chevre-carrefour-3560070927357?t=36993
Fromage Râpé Cheddar CARREFOUR;2,59 €;17.27 € / KG;3560071019006;D;-15% MARDI PASS;https://www.carrefour.fr/p/fromage-rape-cheddar-carrefour-3560071019006?t=36993
Fromage crottin de chèvre CARREFOUR;2,65 €;22.08 € / KG;3560071178376;D;-15% MARDI PASS;https://www.carrefour.fr/p/fromage-crottin-de-chevre-carrefour-3560071178376?t=36993
Fromage blanc nature DANONE;2,99 €;3.74 € / KG;3033491273827;;;https://www.carrefour.fr/p/fromage-blanc-nature-danone-3033491273827
Fromage en Tranches à Raclette Aux Oignons CARREFOUR;3,69 €;14.76 € / KG;3560071178437;D;Ouvrir description de la promotion Le 2ème à -30%;https://www.carrefour.fr/p/fromage-en-tranches-a-raclette-aux-oignons-carrefour-3560071178437?t=36993
Fromage en Tranches à Raclette Classique Sans Croûte CARREFOUR;6,69 €;9.56 € / KG;3560071178468;D;Ouvrir description de la promotion Le 2ème à -30%;https://www.carrefour.fr/p/fromage-en-tranches-a-raclette-classique-sans-croute-carrefour-3560071178468?t=36993
Fromage blanc de Campagne CARREFOUR;3,35 €;3.35 € / KG;3560071153144;C;-15% MARDI PASS;https://www.carrefour.fr/p/fromage-blanc-de-campagne-carrefour-3560071153144?t=36993
Fromage blanc marrons CARREFOUR;2,39 €;9.56 € / KG;3560071232634;C;-15% MARDI PASS;https://www.carrefour.fr/p/fromage-blanc-marrons-carrefour-3560071232634?t=36993
Fromage de chèvre Cabécou CARREFOUR;2,25 €;21.43 € / KG;3560070591565;;-15% MARDI PASS;https://www.carrefour.fr/p/fromage-de-chevre-cabecou-carrefour-3560070591565?t=36993
Fromage de chèvre CARREFOUR;1,89 €;10.50 € / KG;3560071093716;D;-15% MARDI PASS;https://www.carrefour.fr/p/fromage-de-chevre-carrefour-3560071093716?t=36993
Gâteau de semoule aux raisins et caramel CARREFOUR;2,25 €;5.62 € / KG;3270190202837;C;-15% MARDI PASS;https://www.carrefour.fr/p/gateau-de-semoule-aux-raisins-et-caramel-carrefour-3270190202837?t=36993
Lait Demi-Ecreme Stérilisé UHT de Montagne CARREFOUR;6,54 €;1.09 € / L;3270190452041;;-15% MARDI PASS;https://www.carrefour.fr/p/lait-demi-ecreme-sterilise-uht-de-montagne-carrefour-3270190452041?t=36993
Lait Demi-Ecreme Stérilisé UHT Réduit en lactose CARREFOUR;8,04 €;1.34 € / L;3560070437412;;-15% MARDI PASS;https://www.carrefour.fr/p/lait-demi-ecreme-sterilise-uht-reduit-en-lactose-carrefour-3560070437412?t=36993
Lait Fermenté Calcium CARREFOUR;1,55 €;1.55 € / L;3560070860197;A;-15% MARDI PASS;https://www.carrefour.fr/p/lait-fermente-calcium-carrefour-3560070860197?t=36993
Lait demi-écrémé CARREFOUR;6,48 €;1.08 € / L;3560071013301;;-15% MARDI PASS;https://www.carrefour.fr/p/lait-demi-ecreme-carrefour-3560071013301?t=36993
Lait UHT PL Demi-Ecreme du Grand Ouest CARREFOUR;6,30 €;1.05 € / L;3560071013424;;-15% MARDI PASS;https://www.carrefour.fr/p/lait-uht-pl-demi-ecreme-du-grand-ouest-carrefour-3560071013424?t=36993
Lait Demi-Ecreme Stérilisé UHT Calcium du Grand Ouest CARREFOUR;6,48 €;1.08 € / L;3560071013431;;-15% MARDI PASS;https://www.carrefour.fr/p/lait-demi-ecreme-sterilise-uht-calcium-du-grand-ouest-carrefour-3560071013431?t=36993
Lait Demi-Ecreme Stérilisé UHT Calcium du Centre de la France CARREFOUR;6,30 €;1.05 € / L;3560071013462;;-15% MARDI PASS;https://www.carrefour.fr/p/lait-demi-ecreme-sterilise-uht-calcium-du-centre-de-la-france-carrefour-3560071013462?t=36993
Lait Demi-Ecreme Stérilisé UHT Calcium du Centre de la France CARREFOUR;6,48 €;1.08 € / L;3560071013479;;-15% MARDI PASS;https://www.carrefour.fr/p/lait-demi-ecreme-sterilise-uht-calcium-du-centre-de-la-france-carrefour-3560071013479?t=36993
Maasdam CARREFOUR;2,59 €;7.85 € / KG;3560070247530;D;-15% MARDI PASS;https://www.carrefour.fr/p/maasdam-carrefour-3560070247530?t=36993
Matière grasse laitière à tartiner doux CARREFOUR;1,75 €;7.00 € / KG;3560070166893;D;-15% MARDI PASS;https://www.carrefour.fr/p/matiere-grasse-laitiere-a-tartiner-doux-carrefour-3560070166893?t=36993
matière grasse végétale tartine & cuisson doux Tartine et Cuisson 55% Mat.Gr. CARREFOUR;1,45 €;2.90 € / KG;3560070616589;C;;https://www.carrefour.fr/p/matiere-grasse-vegetale-tartine-cuisson-doux-tartine-et-cuisson-55-mat-gr-carrefour-3560070616589?t=36993
Mimolette tranches CARREFOUR;1,95 €;9.75 € / KG;3560070100514;;Ouvrir description de la promotion Le 2ème à -30%;https://www.carrefour.fr/p/mimolette-tranches-carrefour-3560070100514?t=36993
Mousse crème de marron CARREFOUR;1,79 €;6.13 € / KG;3560070698295;C;-15% MARDI PASS;https://www.carrefour.fr/p/mousse-creme-de-marron-carrefour-3560070698295?t=36993
Mousse de crème sur fromage frais nature CARREFOUR;1,49 €;3.72 € / KG;3245411205621;C;-15% MARDI PASS;https://www.carrefour.fr/p/mousse-de-creme-sur-fromage-frais-nature-carrefour-3245411205621?t=36993
Mousse de crème fouettée sur fromage frais nature CARREFOUR;2,79 €;3.49 € / KG;3560070809684;C;-15% MARDI PASS;https://www.carrefour.fr/p/mousse-de-creme-fouettee-sur-fromage-frais-nature-carrefour-3560070809684?t=36993
Mousse liégeoise au café CARREFOUR;1,25 €;3.91 € / KG;3270190216780;C;-15% MARDI PASS;https://www.carrefour.fr/p/mousse-liegeoise-au-cafe-carrefour-3270190216780?t=36993
Parmigiano Reggiano AOP CARREFOUR;3,50 €;21.90 € / KG;3700650500116;;Ouvrir description de la promotion A saisir;https://www.carrefour.fr/p/parmigiano-reggiano-aop-carrefour-3700650500116?t=36993
Petit suisse nature 10,4% MG CARREFOUR;2,09 €;2.90 € / KG;3560070778096;;-15% MARDI PASS;https://www.carrefour.fr/p/petit-suisse-nature-10-4-mg-carrefour-3560070778096?t=36993
Riz au lait vanille CARREFOUR;1,39 €;3.02 € / KG;3560071073947;;-15% MARDI PASS;https://www.carrefour.fr/p/riz-au-lait-vanille-carrefour-3560071073947?t=36993
Rocamadour fermier CARREFOUR;1,60 €;45.71 € / KG;3245414506664;;-15% MARDI PASS;https://www.carrefour.fr/p/rocamadour-fermier-carrefour-3245414506664?t=36993
Semoule au lait vanille CARREFOUR;1,25 €;2.72 € / KG;3560070951673;;-15% MARDI PASS;https://www.carrefour.fr/p/semoule-au-lait-vanille-carrefour-3560070951673?t=36993
Semoule au lait vanille CARREFOUR;2,35 €;2.55 € / KG;3560071225087;C;-15% MARDI PASS;https://www.carrefour.fr/p/semoule-au-lait-vanille-carrefour-3560071225087?t=36993
Tomme du Chatelard CARREFOUR;14,50 €;14.50 € / KG;3276550198109;;;https://www.carrefour.fr/p/tomme-du-chatelard-carrefour-3276550198109?t=36993
Tomme brebis CARREFOUR;2,50 €;16.67 € / KG;3492848305008;;;https://www.carrefour.fr/p/tomme-brebis-carrefour-3492848305008?t=36993
Tomme de Brebis CARREFOUR;3,35 €;16.75 € / KG;3560070541607;;-15% MARDI PASS;https://www.carrefour.fr/p/tomme-de-brebis-carrefour-3560070541607?t=36993
Yaourts lait entier vanille CARREFOUR;2,59 €;2.59 € / KG;3270190021445;C;-15% MARDI PASS;https://www.carrefour.fr/p/yaourts-lait-entier-vanille-carrefour-3270190021445?t=36993
Yaourts à la vanille CARREFOUR;1,35 €;2.70 € / KG;3560070778157;C;-15% MARDI PASS;https://www.carrefour.fr/p/yaourts-a-la-vanille-carrefour-3560070778157?t=36993
Yaourts lait entier à l'arome naturel de fruits CARREFOUR;2,95 €;2.95 € / KG;3560071019976;;-15% MARDI PASS;https://www.carrefour.fr/p/yaourts-lait-entier-a-l-arome-naturel-de-fruits-carrefour-3560071019976?t=36993
Yaourts grec CARREFOUR;4,75 €;4.75 € / KG;3560071411220;;-15% MARDI PASS;https://www.carrefour.fr/p/yaourts-grec-carrefour-3560071411220?t=36993
Beurre de montagne doux CARREFOUR EXTRA;2,79 €;11.16 € / KG;3560071445614;E;-15% MARDI PASS;https://www.carrefour.fr/p/beurre-de-montagne-doux-carrefour-extra-3560071445614?t=36993
Beurre de montagne demi-sel CARREFOUR EXTRA;2,79 €;11.16 € / KG;3560071445621;E;-15% MARDI PASS;https://www.carrefour.fr/p/beurre-de-montagne-demi-sel-carrefour-extra-3560071445621?t=36993
Burrata à la truffe d'été 3% CARREFOUR EXTRA;2,99 €;24.92 € / KG;3560071503734;;-15% MARDI PASS;https://www.carrefour.fr/p/burrata-a-la-truffe-d-ete-3-carrefour-extra-3560071503734?t=36993
Burrata fumée CARREFOUR EXTRA;2,89 €;28.90 € / KG;3560071526399;;-15% MARDI PASS;https://www.carrefour.fr/p/burrata-fumee-carrefour-extra-3560071526399?t=36993
Camembert di Buffala Di Bufala CARREFOUR EXTRA;4,49 €;17.96 € / KG;3560071561390;;-15% MARDI PASS;https://www.carrefour.fr/p/camembert-di-buffala-di-bufala-carrefour-extra-3560071561390?t=36993
Cantal AOP jeune CARREFOUR EXTRA;2,45 €;13.61 € / KG;3560071437893;D;-15% MARDI PASS;https://www.carrefour.fr/p/cantal-aop-jeune-carrefour-extra-3560071437893?t=36993
Comté Au Lait Cru AOP CARREFOUR EXTRA;3,59 €;14.36 € / KG;3560070930036;D;-15% MARDI PASS;https://www.carrefour.fr/p/comte-au-lait-cru-aop-carrefour-extra-3560070930036?t=36993
Comté Au Lait Cru AOP CARREFOUR EXTRA;6,19 €;13.76 € / KG;3560070930128;D;-15% MARDI PASS;https://www.carrefour.fr/p/comte-au-lait-cru-aop-carrefour-extra-3560070930128?t=36993
Comté râpé AOP CARREFOUR EXTRA;2,25 €;15.00 € / KG;3560070931835;D;-15% MARDI PASS;https://www.carrefour.fr/p/comte-rape-aop-carrefour-extra-3560070931835?t=36993
Crème légère fluide CARREFOUR EXTRA;2,45 €;4.08 € / L;3560071489380;D;-15% MARDI PASS;https://www.carrefour.fr/p/creme-legere-fluide-carrefour-extra-3560071489380?t=36993
Crème entière fluide 30% MG CARREFOUR EXTRA;3,25 €;5.42 € / KG;3560071417901;D;-15% MARDI PASS;https://www.carrefour.fr/p/creme-entiere-fluide-30-mg-carrefour-extra-3560071417901?t=36993
Crème Fraîche Entière 30% Mg CARREFOUR EXTRA;2,69 €;5.38 € / L;3560071417970;D;-15% MARDI PASS;https://www.carrefour.fr/p/creme-fraiche-entiere-30-mg-carrefour-extra-3560071417970?t=36993
Dessert Tiramisu CARREFOUR EXTRA;3,29 €;6.58 € / KG;3245412702815;;-15% MARDI PASS;https://www.carrefour.fr/p/dessert-tiramisu-carrefour-extra-3245412702815?t=36993
Desserts mousse liégeoise chocolat CARREFOUR EXTRA;2,35 €;3.67 € / KG;3560070886807;C;-15% MARDI PASS;https://www.carrefour.fr/p/desserts-mousse-liegeoise-chocolat-carrefour-extra-3560070886807?t=36993
Desserts mousse liégeoise vanille CARREFOUR EXTRA;1,35 €;4.22 € / KG;3560071014650;C;-15% MARDI PASS;https://www.carrefour.fr/p/desserts-mousse-liegeoise-vanille-carrefour-extra-3560071014650?t=36993
Edam Holland IGP CARREFOUR EXTRA;3,69 €;12.72 € / KG;3560070799336;E;-15% MARDI PASS;https://www.carrefour.fr/p/edam-holland-igp-carrefour-extra-3560070799336?t=36993
Emmental Grand Cru IGP CARREFOUR EXTRA;3,65 €;14.60 € / KG;3560070470570;D;-15% MARDI PASS;https://www.carrefour.fr/p/emmental-grand-cru-igp-carrefour-extra-3560070470570?t=36993
Féta cubes AOP CARREFOUR EXTRA;2,59 €;17.27 € / KG;3560071456108;D;-15% MARDI PASS;https://www.carrefour.fr/p/feta-cubes-aop-carrefour-extra-3560071456108?t=36993
Fromage feta CARREFOUR EXTRA;2,45 €;12.25 € / KG;3560070149278;C;Ouvrir description de la promotion Le 2ème à -30%;https://www.carrefour.fr/p/fromage-feta-carrefour-extra-3560070149278?t=36993
Fromage Cantal jeune AOP CARREFOUR EXTRA;3,95 €;15.80 € / KG;3560070512560;D;-15% MARDI PASS;https://www.carrefour.fr/p/fromage-cantal-jeune-aop-carrefour-extra-3560070512560?t=36993
Fromage Burrata CARREFOUR EXTRA;4,49 €;22.45 € / KG;3560070888481;;-15% MARDI PASS;https://www.carrefour.fr/p/fromage-burrata-carrefour-extra-3560070888481?t=36993
Fromage Pecorino Romano AOP râpé CARREFOUR EXTRA;1,49 €;29.80 € / KG;3560071012823;E;-15% MARDI PASS;https://www.carrefour.fr/p/fromage-pecorino-romano-aop-rape-carrefour-extra-3560071012823?t=36993
Fromage Burrata di Bufala CARREFOUR EXTRA;2,99 €;23.92 € / KG;3560071413675;;-15% MARDI PASS;https://www.carrefour.fr/p/fromage-burrata-di-bufala-carrefour-extra-3560071413675?t=36993
Fromage Scamorza Affumicata CARREFOUR EXTRA;2,99 €;11.96 € / KG;3560071458713;;-15% MARDI PASS;https://www.carrefour.fr/p/fromage-scamorza-affumicata-carrefour-extra-3560071458713?t=36993
Fromage Halloumi AOP CARREFOUR EXTRA;2,99 €;13.29 € / KG;3560071458720;E;-15% MARDI PASS;https://www.carrefour.fr/p/fromage-halloumi-aop-carrefour-extra-3560071458720?t=36993
Fromage Ossau-Iraty AOP CARREFOUR EXTRA;3,29 €;18.28 € / KG;3560071504236;D;-15% MARDI PASS;https://www.carrefour.fr/p/fromage-ossau-iraty-aop-carrefour-extra-3560071504236?t=36993
Fromage assortiment raclette CARREFOUR EXTRA;10,99 €;18.32 € / KG;3560071536121;;Ouvrir description de la promotion Le 2ème à -30%;https://www.carrefour.fr/p/fromage-assortiment-raclette-carrefour-extra-3560071536121?t=36993
Gorgonzola AOP CARREFOUR EXTRA;2,59 €;17.27 € / KG;3560070338832;D;Ouvrir description de la promotion Le 2ème à -40%;https://www.carrefour.fr/p/gorgonzola-aop-carrefour-extra-3560070338832?t=36993
Gouda Holland IGP jeune CARREFOUR EXTRA;3,85 €;12.83 € / KG;3560070799367;D;-15% MARDI PASS;https://www.carrefour.fr/p/gouda-holland-igp-jeune-carrefour-extra-3560070799367?t=36993
Gouda cumin CARREFOUR EXTRA;2,50 €;11.90 € / KG;3560071533410;D;-15% MARDI PASS;https://www.carrefour.fr/p/gouda-cumin-carrefour-extra-3560071533410?t=36993
Grana padano AOP CARREFOUR EXTRA;3,35 €;16.75 € / KG;3560070514786;D;-15% MARDI PASS;https://www.carrefour.fr/p/grana-padano-aop-carrefour-extra-3560070514786?t=36993
Grana padano râpé CARREFOUR EXTRA;1,55 €;15.50 € / KG;3560071455804;D;-15% MARDI PASS;https://www.carrefour.fr/p/grana-padano-rape-carrefour-extra-3560071455804?t=36993
Lait entier CARREFOUR EXTRA;1,20 €;1.20 € / L;3270190021162;B;-15% MARDI PASS;https://www.carrefour.fr/p/lait-entier-carrefour-extra-3270190021162?t=36993
Lait de montagne entier CARREFOUR EXTRA;1,25 €;1.25 € / L;3270190207443;B;-15% MARDI PASS;https://www.carrefour.fr/p/lait-de-montagne-entier-carrefour-extra-3270190207443?t=36993
Lait demi-écrémé CARREFOUR EXTRA;5,34 €;1.78 € / L;3270190214311;A;-15% MARDI PASS;https://www.carrefour.fr/p/lait-demi-ecreme-carrefour-extra-3270190214311?t=36993
Lait écrémé CARREFOUR EXTRA;6,48 €;1.08 € / L;3270190218999;A;-15% MARDI PASS;https://www.carrefour.fr/p/lait-ecreme-carrefour-extra-3270190218999?t=36993
Lait entier CARREFOUR EXTRA;7,50 €;1.25 € / L;3270190219002;B;-15% MARDI PASS;https://www.carrefour.fr/p/lait-entier-carrefour-extra-3270190219002?t=36993
Lait demi écrémé CARREFOUR EXTRA;6,66 €;1.11 € / L;3270190430049;;-15% MARDI PASS;https://www.carrefour.fr/p/lait-demi-ecreme-carrefour-extra-3270190430049?t=36993
