name;price;unit_price;ean;nutriscore;promo;url
Yaourts nature sucré CARREFOUR CLASSIC';0,99 €;1.98 € / KG;3560070816194;C;-15% MARDI PASS;https://www.carrefour.fr/p/yaourts-nature-sucre-carrefour-classic-3560070816194?t=36993
Yaourts nature sucré CARREFOUR CLASSIC';2,75 €;1.83 € / KG;3560070816279;C;-15% MARDI PASS;https://www.carrefour.fr/p/yaourts-nature-sucre-carrefour-classic-3560070816279?t=36993
Yaourts nature sucré CARREFOUR CLASSIC';2,89 €;1.44 € / KG;3560070816323;C;-15% MARDI PASS;https://www.carrefour.fr/p/yaourts-nature-sucre-carrefour-classic-3560070816323?t=36993
Yaourts fruits rouges mixés brassé CARREFOUR CLASSIC';2,29 €;2.29 € / KG;3560070872466;B;-15% MARDI PASS;https://www.carrefour.fr/p/yaourts-fruits-rouges-mixes-brasse-carrefour-classic-3560070872466?t=36993
Yaourts fruits jaunes mixés brassé CARREFOUR CLASSIC';2,29 €;2.29 € / KG;3560070872497;B;-15% MARDI PASS;https://www.carrefour.fr/p/yaourts-fruits-jaunes-mixes-brasse-carrefour-classic-3560070872497?t=36993
Yaourts nature CARREFOUR CLASSIC';0,65 €;1.30 € / KG;3560071016944;A;-15% MARDI PASS;https://www.carrefour.fr/p/yaourts-nature-carrefour-classic-3560071016944?t=36993
Yaourts chèvre nature CARREFOUR CLASSIC';1,65 €;3.59 € / KG;3560071085612;B;-15% MARDI PASS;https://www.carrefour.fr/p/yaourts-chevre-nature-carrefour-classic-3560071085612?t=36993
Yaourts chèvre vanille CARREFOUR CLASSIC';1,85 €;4.02 € / KG;3560071085629;C;-15% MARDI PASS;https://www.carrefour.fr/p/yaourts-chevre-vanille-carrefour-classic-3560071085629?t=36993
Yaourts de brebis nature CARREFOUR CLASSIC';2,19 €;4.38 € / KG;3560071229924;A;-15% MARDI PASS;https://www.carrefour.fr/p/yaourts-de-brebis-nature-carrefour-classic-3560071229924?t=36993
Yaourts aux fruits bifidus CARREFOUR CLASSIC';3,39 €;2.26 € / KG;3560071411466;B;-15% MARDI PASS;https://www.carrefour.fr/p/yaourts-aux-fruits-bifidus-carrefour-classic-3560071411466?t=36993
Yaourts aux fruits bifidus CARREFOUR CLASSIC';5,15 €;2.58 € / KG;3560071416362;B;-15% MARDI PASS;https://www.carrefour.fr/p/yaourts-aux-fruits-bifidus-carrefour-classic-3560071416362?t=36993
Yaourts au lait de chèvre nature CARREFOUR CLASSIC';3,19 €;3.47 € / KG;3560071492465;B;-15% MARDI PASS;https://www.carrefour.fr/p/yaourts-au-lait-de-chevre-nature-carrefour-classic-3560071492465?t=36993
Bleu d'Auvergne AOP CARREFOUR CLASSIC;2,50 €;12.50 € / KG;3560071533458;E;-15% MARDI PASS;https://www.carrefour.fr/p/bleu-d-auvergne-aop-carrefour-classic-3560071533458?t=36993
Cantal jeune CARREFOUR CLASSIC;2,50 €;12.50 € / KG;3560071533465;D;-15% MARDI PASS;https://www.carrefour.fr/p/cantal-jeune-carrefour-classic-3560071533465?t=36993
Crème Semi-Epaisse 30% CARREFOUR CLASSIC;3,09 €;6.18 € / L;3560071562274;D;-15% MARDI PASS;https://www.carrefour.fr/p/creme-semi-epaisse-30-carrefour-classic-3560071562274?t=36993
Dés de fromage dés mimolette/gouda CARREFOUR CLASSIC;2,69 €;17.93 € / KG;3560070570898;;-15% MARDI PASS;https://www.carrefour.fr/p/des-de-fromage-des-mimolette-gouda-carrefour-classic-3560070570898?t=36993
Dés de fromage dés de gouda cumin CARREFOUR CLASSIC;1,95 €;13.00 € / KG;3560070873982;D;-15% MARDI PASS;https://www.carrefour.fr/p/des-de-fromage-des-de-gouda-cumin-carrefour-classic-3560070873982?t=36993
Dés de fromage chèvre, basilic, mimolette CARREFOUR CLASSIC;3,15 €;21.00 € / KG;3560071007386;;-15% MARDI PASS;https://www.carrefour.fr/p/des-de-fromage-chevre-basilic-mimolette-carrefour-classic-3560071007386?t=36993
Dés de fromage dés de chèvre CARREFOUR CLASSIC;2,89 €;19.27 € / KG;3560071007409;D;-15% MARDI PASS;https://www.carrefour.fr/p/des-de-fromage-des-de-chevre-carrefour-classic-3560071007409?t=36993
Emmental en tranche CARREFOUR CLASSIC;1,79 €;11.19 € / KG;3560071561567;D;-15% MARDI PASS;https://www.carrefour.fr/p/emmental-en-tranche-carrefour-classic-3560071561567?t=36993
Fromage Mimolette en Tranches CARREFOUR CLASSIC;2,85 €;9.50 € / KG;3560071549527;D;Ouvrir description de la promotion Le 2ème à -30%;https://www.carrefour.fr/p/fromage-mimolette-en-tranches-carrefour-classic-3560071549527?t=36993
Fromage Gouda en Tranches CARREFOUR CLASSIC;2,85 €;9.50 € / KG;3560071549558;D;Ouvrir description de la promotion Le 2ème à -30%;https://www.carrefour.fr/p/fromage-gouda-en-tranches-carrefour-classic-3560071549558?t=36993
Fromage le P'tit Rond CARREFOUR CLASSIC;1,50 €;12.00 € / KG;3560071561628;;-15% MARDI PASS;https://www.carrefour.fr/p/fromage-le-p-tit-rond-carrefour-classic-3560071561628?t=36993
Fromage Râpé Cheddar CARREFOUR CLASSIC;2,99 €;11.96 € / KG;3560071533526;D;-15% MARDI PASS;https://www.carrefour.fr/p/fromage-rape-cheddar-carrefour-classic-3560071533526?t=36993
Gouda jeune CARREFOUR CLASSIC;2,50 €;11.90 € / KG;3560071533441;D;-15% MARDI PASS;https://www.carrefour.fr/p/gouda-jeune-carrefour-classic-3560071533441?t=36993
Mozzarella en tranches CARREFOUR CLASSIC;2,85 €;14.25 € / KG;3560070168538;D;-15% MARDI PASS;https://www.carrefour.fr/p/mozzarella-en-tranches-carrefour-classic-3560070168538?t=36993
Mozzarella râpée CARREFOUR CLASSIC;1,39 €;9.27 € / KG;3560070978489;D;-15% MARDI PASS;https://www.carrefour.fr/p/mozzarella-rapee-carrefour-classic-3560070978489?t=36993
Tomme de montagne grise CARREFOUR CLASSIC;2,50 €;12.50 € / KG;3560071533489;D;-15% MARDI PASS;https://www.carrefour.fr/p/tomme-de-montagne-grise-carrefour-classic-3560071533489?t=36993
Crème dessert chocolat et lait CARREFOUR KIDS;1,35 €;3.21 € / KG;3560070886838;;-15% MARDI PASS;https://www.carrefour.fr/p/creme-dessert-chocolat-et-lait-carrefour-kids-3560070886838?t=36993
Yaourts vanille framboise CARREFOUR KIDS;2,95 €;5.46 € / KG;3560070354566;B;-15% MARDI PASS;https://www.carrefour.fr/p/yaourts-vanille-framboise-carrefour-kids-3560070354566?t=36993
Beurre moulé de Bretagne demi-sel CARREFOUR ORIGINAL;2,59 €;10.36 € / KG;3270190020295;E;-15% MARDI PASS;https://www.carrefour.fr/p/beurre-moule-de-bretagne-demi-sel-carrefour-original-3270190020295?t=36993
Beurre moulé demi-sel CARREFOUR ORIGINAL;4,95 €;9.90 € / KG;3270190020561;E;-15% MARDI PASS;https://www.carrefour.fr/p/beurre-moule-demi-sel-carrefour-original-3270190020561?t=36993
Beurre moulé de Bretagne doux CARREFOUR ORIGINAL;2,59 €;10.36 € / KG;3270190022824;E;-15% MARDI PASS;https://www.carrefour.fr/p/beurre-moule-de-bretagne-doux-carrefour-original-3270190022824?t=36993
Beurre moulé Bretagne doux CARREFOUR ORIGINAL;4,95 €;9.90 € / KG;3270190022831;E;-15% MARDI PASS;https://www.carrefour.fr/p/beurre-moule-bretagne-doux-carrefour-original-3270190022831?t=36993
Beurre de baratte doux CARREFOUR ORIGINAL;2,85 €;11.40 € / KG;3560070900565;E;-15% MARDI PASS;https://www.carrefour.fr/p/beurre-de-baratte-doux-carrefour-original-3560070900565?t=36993
Beurre de Baratte demi-sel CARREFOUR ORIGINAL;2,85 €;11.40 € / KG;3560070900596;E;-15% MARDI PASS;https://www.carrefour.fr/p/beurre-de-baratte-demi-sel-carrefour-original-3560070900596?t=36993
Beurre moulé de Bretagne doux CARREFOUR ORIGINAL;4,95 €;9.90 € / KG;3560071503383;E;-15% MARDI PASS;https://www.carrefour.fr/p/beurre-moule-de-bretagne-doux-carrefour-original-3560071503383?t=36993
Beurre moulé de Bretagne demi-sel CARREFOUR ORIGINAL;4,95 €;9.90 € / KG;3560071503390;E;-15% MARDI PASS;https://www.carrefour.fr/p/beurre-moule-de-bretagne-demi-sel-carrefour-original-3560071503390?t=36993
Camembert au lait cru AOP CARREFOUR ORIGINAL;3,25 €;13.00 € / KG;3560071480288;D;-15% MARDI PASS;https://www.carrefour.fr/p/camembert-au-lait-cru-aop-carrefour-original-3560071480288?t=36993
Clafoutis aux Abricots CARREFOUR ORIGINAL;2,29 €;6.74 € / KG;3560071563615;C;-15% MARDI PASS;https://www.carrefour.fr/p/clafoutis-aux-abricots-carrefour-original-3560071563615?t=36993
Crème caramel CARREFOUR ORIGINAL;1,69 €;4.22 € / KG;3270190026273;C;-15% MARDI PASS;https://www.carrefour.fr/p/creme-caramel-carrefour-original-3270190026273?t=36993
Crème caramel CARREFOUR ORIGINAL;2,49 €;10.38 € / KG;3560071010850;D;-15% MARDI PASS;https://www.carrefour.fr/p/creme-caramel-carrefour-original-3560071010850?t=36993
Crème aux œufs saveur vanille CARREFOUR ORIGINAL;1,49 €;3.72 € / KG;3245413843937;C;-15% MARDI PASS;https://www.carrefour.fr/p/creme-aux-oeufs-saveur-vanille-carrefour-original-3245413843937?t=36993
Crème aux œufs saveur coco caramel CARREFOUR ORIGINAL;2,25 €;5.62 € / KG;3560071191429;D;-15% MARDI PASS;https://www.carrefour.fr/p/creme-aux-oeufs-saveur-coco-caramel-carrefour-original-3560071191429?t=36993
Crème dessert café CARREFOUR ORIGINAL;1,85 €;4.62 € / KG;3270190216827;D;-15% MARDI PASS;https://www.carrefour.fr/p/creme-dessert-cafe-carrefour-original-3270190216827?t=36993
Crème dessert chocolat CARREFOUR ORIGINAL;2,49 €;10.38 € / KG;3560071014384;D;-15% MARDI PASS;https://www.carrefour.fr/p/creme-dessert-chocolat-carrefour-original-3560071014384?t=36993
Crème dessert à la pistache CARREFOUR ORIGINAL;2,49 €;10.38 € / KG;3560071487492;D;-15% MARDI PASS;https://www.carrefour.fr/p/creme-dessert-a-la-pistache-carrefour-original-3560071487492?t=36993
Crèmes dessert caramel CARREFOUR ORIGINAL;1,85 €;4.62 € / KG;3245412404375;D;-15% MARDI PASS;https://www.carrefour.fr/p/cremes-dessert-caramel-carrefour-original-3245412404375?t=36993
Crèmes dessert vanille CARREFOUR ORIGINAL;1,85 €;4.62 € / KG;3270190216803;D;-15% MARDI PASS;https://www.carrefour.fr/p/cremes-dessert-vanille-carrefour-original-3270190216803?t=36993
Crèmes dessert chocolat CARREFOUR ORIGINAL;1,99 €;4.98 € / KG;3270190216810;C;-15% MARDI PASS;https://www.carrefour.fr/p/cremes-dessert-chocolat-carrefour-original-3270190216810?t=36993
Crèmes dessert chocolat CARREFOUR ORIGINAL;3,89 €;4.86 € / KG;3560070836246;C;-15% MARDI PASS;https://www.carrefour.fr/p/cremes-dessert-chocolat-carrefour-original-3560070836246?t=36993
Crèmes dessert vanille CARREFOUR ORIGINAL;3,45 €;4.31 € / KG;3560070964048;D;-15% MARDI PASS;https://www.carrefour.fr/p/cremes-dessert-vanille-carrefour-original-3560070964048?t=36993
Dessert crème pistache CARREFOUR ORIGINAL;1,85 €;4.62 € / KG;3245412404405;D;-15% MARDI PASS;https://www.carrefour.fr/p/dessert-creme-pistache-carrefour-original-3245412404405?t=36993
Dessert Baba au rhum CARREFOUR ORIGINAL;1,45 €;6.04 € / KG;3245412404474;C;-15% MARDI PASS;https://www.carrefour.fr/p/dessert-baba-au-rhum-carrefour-original-3245412404474?t=36993
Dessert profiteroles au chocolat CARREFOUR ORIGINAL;2,49 €;6.92 € / KG;3245412435263;C;Ouvrir description de la promotion Le 2ème à -20%;https://www.carrefour.fr/p/dessert-profiteroles-au-chocolat-carrefour-original-3245412435263?t=36993
Dessert Tiramisu au café CARREFOUR ORIGINAL;2,99 €;8.31 € / KG;3245414658769;D;Ouvrir description de la promotion Le 2ème à -30%;https://www.carrefour.fr/p/dessert-tiramisu-au-cafe-carrefour-original-3245414658769?t=36993
Dessert ile flottante CARREFOUR ORIGINAL;1,89 €;4.72 € / KG;3270190204367;C;-15% MARDI PASS;https://www.carrefour.fr/p/dessert-ile-flottante-carrefour-original-3270190204367?t=36993
Dessert Tiramisu au spéculoos CARREFOUR ORIGINAL;2,25 €;11.25 € / KG;3560070695362;D;-15% MARDI PASS;https://www.carrefour.fr/p/dessert-tiramisu-au-speculoos-carrefour-original-3560070695362?t=36993
Dessert Panna Cotta lit de caramel CARREFOUR ORIGINAL;1,89 €;5.25 € / KG;3560070730193;D;-15% MARDI PASS;https://www.carrefour.fr/p/dessert-panna-cotta-lit-de-caramel-carrefour-original-3560070730193?t=36993
Dessert panna cotta à la framboise CARREFOUR ORIGINAL;2,49 €;10.38 € / KG;3560070816415;D;-15% MARDI PASS;https://www.carrefour.fr/p/dessert-panna-cotta-a-la-framboise-carrefour-original-3560070816415?t=36993
Dessert clafoutis aux cerises CARREFOUR ORIGINAL;2,39 €;7.03 € / KG;3560070835300;C;-15% MARDI PASS;https://www.carrefour.fr/p/dessert-clafoutis-aux-cerises-carrefour-original-3560070835300?t=36993
Dessert Tiramisu framboise CARREFOUR ORIGINAL;2,55 €;12.75 € / KG;3560070885169;C;-15% MARDI PASS;https://www.carrefour.fr/p/dessert-tiramisu-framboise-carrefour-original-3560070885169?t=36993
Dessert Tiramisu au citron CARREFOUR ORIGINAL;2,49 €;12.45 € / KG;3560070959273;C;-15% MARDI PASS;https://www.carrefour.fr/p/dessert-tiramisu-au-citron-carrefour-original-3560070959273?t=36993
Dessert crème brûlée CARREFOUR ORIGINAL;1,45 €;7.25 € / KG;3560070999941;D;-15% MARDI PASS;https://www.carrefour.fr/p/dessert-creme-brulee-carrefour-original-3560070999941?t=36993
Dessert crème brûlée CARREFOUR ORIGINAL;2,69 €;6.72 € / KG;3560071152390;D;-15% MARDI PASS;https://www.carrefour.fr/p/dessert-creme-brulee-carrefour-original-3560071152390?t=36993
Dessert crème aux œufs caramel sel CARREFOUR ORIGINAL;1,79 €;4.48 € / KG;3560071240639;C;-15% MARDI PASS;https://www.carrefour.fr/p/dessert-creme-aux-oeufs-caramel-sel-carrefour-original-3560071240639?t=36993
Dessert barista caramel CARREFOUR ORIGINAL;1,50 €;20.00 € / KG;3560071344641;D;-15% MARDI PASS;https://www.carrefour.fr/p/dessert-barista-caramel-carrefour-original-3560071344641?t=36993
Dessert gâteau de riz caramel CARREFOUR ORIGINAL;1,79 €;3.58 € / KG;3560071450847;C;-15% MARDI PASS;https://www.carrefour.fr/p/dessert-gateau-de-riz-caramel-carrefour-original-3560071450847?t=36993
Dessert riz au lait nature CARREFOUR ORIGINAL;1,39 €;3.02 € / KG;3560071453084;B;-15% MARDI PASS;https://www.carrefour.fr/p/dessert-riz-au-lait-nature-carrefour-original-3560071453084?t=36993
Dessert ile flottante caramel CARREFOUR ORIGINAL;2,25 €;5.62 € / KG;3560071497224;C;-15% MARDI PASS;https://www.carrefour.fr/p/dessert-ile-flottante-caramel-carrefour-original-3560071497224?t=36993
Dessert riz au lait caramel CARREFOUR ORIGINAL;1,69 €;3.67 € / KG;3560071497248;C;-15% MARDI PASS;https://www.carrefour.fr/p/dessert-riz-au-lait-caramel-carrefour-original-3560071497248?t=36993
Dessert crème à la noix de coco CARREFOUR ORIGINAL;2,25 €;5.62 € / KG;3560071523923;C;-15% MARDI PASS;https://www.carrefour.fr/p/dessert-creme-a-la-noix-de-coco-carrefour-original-3560071523923?t=36993
Dessert crème aux oeufs CARREFOUR ORIGINAL;1,79 €;4.48 € / KG;3560071538644;D;-15% MARDI PASS;https://www.carrefour.fr/p/dessert-creme-aux-oeufs-carrefour-original-3560071538644?t=36993
Desserts crème caramel CARREFOUR ORIGINAL;3,15 €;3.94 € / KG;3560070543182;C;-15% MARDI PASS;https://www.carrefour.fr/p/desserts-creme-caramel-carrefour-original-3560070543182?t=36993
Flan aux œufs frais CARREFOUR ORIGINAL;2,99 €;7.48 € / KG;3560070541065;C;-15% MARDI PASS;https://www.carrefour.fr/p/flan-aux-oeufs-frais-carrefour-original-3560070541065?t=36993
Fromage Péché des Bons Pères CARREFOUR ORIGINAL;2,85 €;8.38 € / KG;3560070323661;D;-15% MARDI PASS;https://www.carrefour.fr/p/fromage-peche-des-bons-peres-carrefour-original-3560070323661?t=36993
Fromage en Tranches à Raclette Vin Blanc CARREFOUR ORIGINAL;3,59 €;14.36 € / KG;3560070753895;D;Ouvrir description de la promotion Le 2ème à -30%;https://www.carrefour.fr/p/fromage-en-tranches-a-raclette-vin-blanc-carrefour-original-3560070753895?t=36993
Fromage Délice de crème CARREFOUR ORIGINAL;2,29 €;11.45 € / KG;3560070790678;D;-15% MARDI PASS;https://www.carrefour.fr/p/fromage-delice-de-creme-carrefour-original-3560070790678?t=36993
Fromage Le Péché des Bons Pères CARREFOUR ORIGINAL;3,65 €;8.11 € / KG;3560070869428;D;-15% MARDI PASS;https://www.carrefour.fr/p/fromage-le-peche-des-bons-peres-carrefour-original-3560070869428?t=36993
Fromage Saint-Marcellin CARREFOUR ORIGINAL;2,15 €;13.44 € / KG;3560070891917;D;-15% MARDI PASS;https://www.carrefour.fr/p/fromage-saint-marcellin-carrefour-original-3560070891917?t=36993
Fromage Saint-Félicien CARREFOUR ORIGINAL;2,29 €;12.72 € / KG;3560070891948;D;-15% MARDI PASS;https://www.carrefour.fr/p/fromage-saint-felicien-carrefour-original-3560070891948?t=36993
Fromage en Tranches à Raclette Classique Et Fumée CARREFOUR ORIGINAL;5,59 €;13.98 € / KG;3560070910540;D;Ouvrir description de la promotion Le 2ème à -30%;https://www.carrefour.fr/p/fromage-en-tranches-a-raclette-classique-et-fumee-carrefour-original-3560070910540?t=36993
Fromage en Tranches à Raclette Classique CARREFOUR ORIGINAL;6,69 €;9.56 € / KG;3560071018696;D;Ouvrir description de la promotion Le 2ème à -30%;https://www.carrefour.fr/p/fromage-en-tranches-a-raclette-classique-carrefour-original-3560071018696?t=36993
Fromage en Tranches à Raclette 3 Poivres Sans Croûte CARREFOUR ORIGINAL;3,85 €;15.40 € / KG;3560071223472;D;Ouvrir description de la promotion Le 2ème à -30%;https://www.carrefour.fr/p/fromage-en-tranches-a-raclette-3-poivres-sans-croute-carrefour-original-3560071223472?t=36993
Fromage en Tranches à Raclette Fumée Sans Croûte CARREFOUR ORIGINAL;3,85 €;15.40 € / KG;3560071224950;D;Ouvrir description de la promotion Le 2ème à -30%;https://www.carrefour.fr/p/fromage-en-tranches-a-raclette-fumee-sans-croute-carrefour-original-3560071224950?t=36993
Fromage à tartiner fouetté nature CARREFOUR ORIGINAL;1,49 €;9.93 € / KG;3560071271404;D;-15% MARDI PASS;https://www.carrefour.fr/p/fromage-a-tartiner-fouette-nature-carrefour-original-3560071271404?t=36993
Fromage Fondants des Monts CARREFOUR ORIGINAL;3,69 €;18.45 € / KG;3560071424237;D;-15% MARDI PASS;https://www.carrefour.fr/p/fromage-fondants-des-monts-carrefour-original-3560071424237?t=36993
Fromage à raclette classique CARREFOUR ORIGINAL;3,85 €;9.62 € / KG;3270190207702;D;Ouvrir description de la promotion Le 2ème à -30%;https://www.carrefour.fr/p/fromage-a-raclette-classique-carrefour-original-3270190207702?t=36993
Fromage à raclette classique sans croûte CARREFOUR ORIGINAL;3,99 €;9.98 € / KG;3560070511891;D;Ouvrir description de la promotion Le 2ème à -30%;https://www.carrefour.fr/p/fromage-a-raclette-classique-sans-croute-carrefour-original-3560070511891?t=36993
Fromage à raclette assortiment CARREFOUR ORIGINAL;10,89 €;13.61 € / KG;3560070857494;D;Ouvrir description de la promotion Le 2ème à -30%;https://www.carrefour.fr/p/fromage-a-raclette-assortiment-carrefour-original-3560070857494?t=36993
Fromage à raclette au piment CARREFOUR ORIGINAL;3,69 €;14.76 € / KG;3560071533571;D;Ouvrir description de la promotion Le 2ème à -30%;https://www.carrefour.fr/p/fromage-a-raclette-au-piment-carrefour-original-3560071533571?t=36993
Fromage à raclette à la moutarde CARREFOUR ORIGINAL;3,69 €;14.76 € / KG;3560071533618;D;Ouvrir description de la promotion Le 2ème à -30%;https://www.carrefour.fr/p/fromage-a-raclette-a-la-moutarde-carrefour-original-3560071533618?t=36993
Fromage de brebis CARREFOUR ORIGINAL;2,59 €;17.27 € / KG;3560070650910;D;-15% MARDI PASS;https://www.carrefour.fr/p/fromage-de-brebis-carrefour-original-3560070650910?t=36993
Fromage Raclette A l'Aïl des Ours CARREFOUR ORIGINAL;3,69 €;14.76 € / KG;3560071571795;;Ouvrir description de la promotion Le 2ème à -30%;https://www.carrefour.fr/p/fromage-raclette-a-l-ail-des-ours-carrefour-original-3560071571795?t=36993
Gâteau de riz caramel CARREFOUR ORIGINAL;1,49 €;3.72 € / KG;3270190026853;C;-15% MARDI PASS;https://www.carrefour.fr/p/gateau-de-riz-caramel-carrefour-original-3270190026853?t=36993
Munster AOP CARREFOUR ORIGINAL;2,65 €;13.25 € / KG;3560071419202;D;-15% MARDI PASS;https://www.carrefour.fr/p/munster-aop-carrefour-original-3560071419202?t=36993
Œufs frais poules plein air CARREFOUR ORIGINAL;1,59 €;0.26 € / U;3270190205678;A;-15% MARDI PASS;https://www.carrefour.fr/p/oeufs-frais-poules-plein-air-carrefour-original-3270190205678?t=36993
Œufs plein air CARREFOUR ORIGINAL;2,99 €;0.25 € / U;3270190205685;A;-15% MARDI PASS;https://www.carrefour.fr/p/oeufs-plein-air-carrefour-original-3270190205685?t=36993
Œufs frais Label Rouge plein air CARREFOUR ORIGINAL;3,55 €;0.30 € / U;3560070773275;A;-15% MARDI PASS;https://www.carrefour.fr/p/oeufs-frais-label-rouge-plein-air-carrefour-original-3560070773275?t=36993
Œufs frais poules plein air CARREFOUR ORIGINAL;4,49 €;0.25 € / U;3560070944286;A;-15% MARDI PASS;https://www.carrefour.fr/p/oeufs-frais-poules-plein-air-carrefour-original-3560070944286?t=36993
Œufs de Plein Air moyen Mabel Rouge CARREFOUR ORIGINAL;1,85 €;0.31 € / U;3245412847059;A;-15% MARDI PASS;https://www.carrefour.fr/p/oeufs-de-plein-air-moyen-mabel-rouge-carrefour-original-3245412847059?t=36993
Riz au lait nature CARREFOUR ORIGINAL;1,99 €;7.65 € / KG;3560071010973;C;-15% MARDI PASS;https://www.carrefour.fr/p/riz-au-lait-nature-carrefour-original-3560071010973?t=36993
Riz au lait saveur vanille CARREFOUR ORIGINAL;2,15 €;2.34 € / KG;3560071074036;B;-15% MARDI PASS;https://www.carrefour.fr/p/riz-au-lait-saveur-vanille-carrefour-original-3560071074036?t=36993
Riz au lait rhum raisin CARREFOUR ORIGINAL;1,69 €;3.67 € / KG;3560071240776;C;-15% MARDI PASS;https://www.carrefour.fr/p/riz-au-lait-rhum-raisin-carrefour-original-3560071240776?t=36993
Yaourts lait entier nature CARREFOUR ORIGINAL;2,35 €;2.35 € / KG;3245412735530;B;-15% MARDI PASS;https://www.carrefour.fr/p/yaourts-lait-entier-nature-carrefour-original-3245412735530?t=36993
Yaourts lait entier citron CARREFOUR ORIGINAL;1,45 €;2.90 € / KG;3560070872404;C;-15% MARDI PASS;https://www.carrefour.fr/p/yaourts-lait-entier-citron-carrefour-original-3560070872404?t=36993
Yaourts pâtissiers 6 recettes CARREFOUR ORIGINAL;3,19 €;2.13 € / KG;3560071416652;B;-15% MARDI PASS;https://www.carrefour.fr/p/yaourts-patissiers-6-recettes-carrefour-original-3560071416652?t=36993
Dessert cœur fondant chocolat noir CARREFOUR SELECTION;2,35 €;13.06 € / KG;3245413527134;D;Ouvrir description de la promotion Le 2ème à -30%;https://www.carrefour.fr/p/dessert-coeur-fondant-chocolat-noir-carrefour-selection-3245413527134?t=36993
Dessert croustillant au citron CARREFOUR SELECTION;2,35 €;14.69 € / KG;3560070607198;;Ouvrir description de la promotion Le 2ème à -30%;https://www.carrefour.fr/p/dessert-croustillant-au-citron-carrefour-selection-3560070607198?t=36993
Dessert cheesecake fruits rouges CARREFOUR SELECTION;2,59 €;16.19 € / KG;3560070698356;;Ouvrir description de la promotion Le 2ème à -30%;https://www.carrefour.fr/p/dessert-cheesecake-fruits-rouges-carrefour-selection-3560070698356?t=36993
Dessert tartelette caramel beurre salé CARREFOUR SELECTION;2,35 €;14.69 € / KG;3560070751082;;Ouvrir description de la promotion Le 2ème à -30%;https://www.carrefour.fr/p/dessert-tartelette-caramel-beurre-sale-carrefour-selection-3560070751082?t=36993
Dessert croustillant au chocolat noir CARREFOUR SELECTION;2,59 €;16.19 € / KG;3560070846757;;Ouvrir description de la promotion Le 2ème à -30%;https://www.carrefour.fr/p/dessert-croustillant-au-chocolat-noir-carrefour-selection-3560070846757?t=36993
Dessert mousse au chocolat noir CARREFOUR SELECTION;3,99 €;14.25 € / KG;3560071016517;;-15% MARDI PASS;https://www.carrefour.fr/p/dessert-mousse-au-chocolat-noir-carrefour-selection-3560071016517?t=36993
Dessert royal au chocolat CARREFOUR SELECTION;3,19 €;19.94 € / KG;3560071018528;;Ouvrir description de la promotion Le 2ème à -30%;https://www.carrefour.fr/p/dessert-royal-au-chocolat-carrefour-selection-3560071018528?t=36993
Dessert Mousse amande sur lit au praliné CARREFOUR SELECTION;3,25 €;20.31 € / KG;3560071151010;;-15% MARDI PASS;https://www.carrefour.fr/p/dessert-mousse-amande-sur-lit-au-praline-carrefour-selection-3560071151010?t=36993
Dessert Mousse pistache chocolat noir CARREFOUR SELECTION;2,99 €;17.59 € / KG;3560071182090;;Ouvrir description de la promotion Le 2ème à -30%;https://www.carrefour.fr/p/dessert-mousse-pistache-chocolat-noir-carrefour-selection-3560071182090?t=36993
Dessert pâtissier cœur fondant caramel CARREFOUR SELECTION;2,35 €;13.06 € / KG;3560071471156;;Ouvrir description de la promotion Le 2ème à -30%;https://www.carrefour.fr/p/dessert-patissier-coeur-fondant-caramel-carrefour-selection-3560071471156?t=36993
Desserts mousse chocolat noir CARREFOUR SELECTION;2,59 €;14.39 € / KG;3560070884759;;Ouvrir description de la promotion Le 2ème à -30%;https://www.carrefour.fr/p/desserts-mousse-chocolat-noir-carrefour-selection-3560070884759?t=36993
Boisson caffè latte CARREFOUR SENSATION;1,09 €;4.36 € / L;3560071495237;E;Ouvrir description de la promotion Le 2ème à -30%;https://www.carrefour.fr/p/boisson-caffe-latte-carrefour-sensation-3560071495237?t=36993
Boisson cappuccino CARREFOUR SENSATION;1,09 €;4.36 € / L;3560071495268;E;Ouvrir description de la promotion Le 2ème à -30%;https://www.carrefour.fr/p/boisson-cappuccino-carrefour-sensation-3560071495268?t=36993
Boisson caramel latte CARREFOUR SENSATION;1,29 €;5.16 € / KG;3560071540098;C;Ouvrir description de la promotion Le 2ème à -30%;https://www.carrefour.fr/p/boisson-caramel-latte-carrefour-sensation-3560071540098?t=36993
Boisson Cappuccino saveur noisette CARREFOUR SENSATION;1,29 €;5.16 € / KG;3560071540104;C;Ouvrir description de la promotion Le 2ème à -30%;https://www.carrefour.fr/p/boisson-cappuccino-saveur-noisette-carrefour-sensation-3560071540104?t=36993
Cheesecakes chocolat caramel CARREFOUR SENSATION;2,39 €;14.94 € / KG;3560071497200;E;-15% MARDI PASS;https://www.carrefour.fr/p/cheesecakes-chocolat-caramel-carrefour-sensation-3560071497200?t=36993
Crème dessert chocolat avec dragées CARREFOUR SENSATION;1,99 €;4.15 € / KG;3560070931521;C;-15% MARDI PASS;https://www.carrefour.fr/p/creme-dessert-chocolat-avec-dragees-carrefour-sensation-3560070931521?t=36993
Crèmes dessert billes 3 chocolats CARREFOUR SENSATION;1,99 €;4.25 € / KG;3560070541423;C;-15% MARDI PASS;https://www.carrefour.fr/p/cremes-dessert-billes-3-chocolats-carrefour-sensation-3560070541423?t=36993
