name;price;unit_price;ean;nutriscore;promo;url
Fromage Léger 9% Mat.Gr. PAVE D'AFFINOIS;2,35 €;13.43 € / KG;3307904150082;C;;https://www.carrefour.fr/p/fromage-leger-9-mat-gr-pave-d-affinois-3307904150082?t=36993
Fromage Bleu PAVE D'AFFINOIS;3,85 €;21.39 € / KG;3307905054082;U;;https://www.carrefour.fr/p/fromage-bleu-pave-d-affinois-3307905054082?t=36993
Fromage poivron piment PAVE D'AFFINOIS;4,10 €;27.33 € / KG;3307905175084;D;;https://www.carrefour.fr/p/fromage-poivron-piment-pave-d-affinois-3307905175084?t=36993
Fromage L'Original PAVE D'AFFINOIS;3,55 €;11.83 € / KG;3307905260063;D;;https://www.carrefour.fr/p/fromage-l-original-pave-d-affinois-3307905260063?t=36993
Fromage extra gourmand PAVE D'AFFINOIS;2,49 €;12.45 € / KG;3307905386060;D;;https://www.carrefour.fr/p/fromage-extra-gourmand-pave-d-affinois-3307905386060?t=36993
Fromage PAVE D'AFFINOIS;2,45 €;13.61 € / KG;3307905440069;;;https://www.carrefour.fr/p/fromage-pave-d-affinois-3307905440069?t=36993
Fromage Mini l'Original Doux et Onctueux PAVE D'AFFINOIS;2,29 €;19.08 € / KG;3307905473067;D;;https://www.carrefour.fr/p/fromage-mini-l-original-doux-et-onctueux-pave-d-affinois-3307905473067?t=36993
Fromage à pâte molle au lait de vache pasteurisé PAVE D'AFFINOIS;5,50 €;18.33 € / KG;3307905500060;;;https://www.carrefour.fr/p/fromage-a-pate-molle-au-lait-de-vache-pasteurise-pave-d-affinois-3307905500060?t=36993
Fromage aux truffes PAVE D'AFFINOIS;5,95 €;39.67 € / KG;3307905760082;;;https://www.carrefour.fr/p/fromage-aux-truffes-pave-d-affinois-3307905760082?t=36993
Fromage Mini L'Original PAVE D'AFFINOIS;2,55 €;14.17 € / KG;3307905810084;D;;https://www.carrefour.fr/p/fromage-mini-l-original-pave-d-affinois-3307905810084?t=36993
Fromage L'Original PAVE D'AFFINOIS;2,45 €;12.25 € / KG;3307907100084;D;;https://www.carrefour.fr/p/fromage-l-original-pave-d-affinois-3307907100084?t=36993
Fromage ambré PAVE D'AFFINOIS;3,50 €;23.33 € / KG;3307907290082;;;https://www.carrefour.fr/p/fromage-ambre-pave-d-affinois-3307907290082?t=36993
Fromage Mini 5 Variétés PAVE D'AFFINOIS;2,65 €;20.38 € / KG;3307907520066;D;;https://www.carrefour.fr/p/fromage-mini-5-varietes-pave-d-affinois-3307907520066?t=36993
Fromage léger PAVE D'AFFINOIS;3,40 €;22.67 € / KG;3307908000062;;;https://www.carrefour.fr/p/fromage-leger-pave-d-affinois-3307908000062?t=36993
Beurre Mini au Sel de Guérande PAYSAN BRETON;3,09 €;15.45 € / KG;3412290011050;;;https://www.carrefour.fr/p/beurre-mini-au-sel-de-guerande-paysan-breton-3412290011050?t=36993
Beurre Doux Moulé PAYSAN BRETON;1,89 €;15.12 € / KG;3412290011067;;;https://www.carrefour.fr/p/beurre-doux-moule-paysan-breton-3412290011067?t=36993
Beurre Demi-Sel Moulé PAYSAN BRETON;1,89 €;15.12 € / KG;3412290011074;;;https://www.carrefour.fr/p/beurre-demi-sel-moule-paysan-breton-3412290011074?t=36993
Beurre Demi-sel Mini PAYSAN BRETON;3,29 €;16.45 € / KG;3412290011104;E;;https://www.carrefour.fr/p/beurre-demi-sel-mini-paysan-breton-3412290011104?t=36993
Beurre Demi-sel Au Sel de Mer Avec Cristaux PAYSAN BRETON;3,45 €;13.80 € / KG;3412290011258;U;;https://www.carrefour.fr/p/beurre-demi-sel-au-sel-de-mer-avec-cristaux-paysan-breton-3412290011258?t=36993
Beurre Doux Moulé PAYSAN BRETON;3,25 €;13.00 € / KG;3412290015980;;;https://www.carrefour.fr/p/beurre-doux-moule-paysan-breton-3412290015980?t=36993
Beurre Demi-Sel Moulé PAYSAN BRETON;3,25 €;13.00 € / KG;3412290015997;;;https://www.carrefour.fr/p/beurre-demi-sel-moule-paysan-breton-3412290015997?t=36993
Beurre Doux Moulé PAYSAN BRETON;6,19 €;12.38 € / KG;3412290016000;;;https://www.carrefour.fr/p/beurre-doux-moule-paysan-breton-3412290016000?t=36993
Beurre Demi-Sel Moulé PAYSAN BRETON;6,19 €;12.38 € / KG;3412290016055;;;https://www.carrefour.fr/p/beurre-demi-sel-moule-paysan-breton-3412290016055?t=36993
Beurre Moulé aux Cristaux de Sel de Guérande PAYSAN BRETON;3,35 €;13.40 € / KG;3412290016185;;;https://www.carrefour.fr/p/beurre-moule-aux-cristaux-de-sel-de-guerande-paysan-breton-3412290016185?t=36993
Beurre Tendre Demi-Sel PAYSAN BRETON;3,09 €;15.45 € / KG;3412290019384;;;https://www.carrefour.fr/p/beurre-tendre-demi-sel-paysan-breton-3412290019384?t=36993
Beurre Demi-Sel PAYSAN BRETON;2,95 €;14.75 € / KG;3412290019407;E;;https://www.carrefour.fr/p/beurre-demi-sel-paysan-breton-3412290019407?t=36993
Beurre Doux PAYSAN BRETON;3,15 €;12.60 € / KG;3412290027686;;;https://www.carrefour.fr/p/beurre-doux-paysan-breton-3412290027686?t=36993
Beurre Demi-Sel PAYSAN BRETON;3,15 €;12.60 € / KG;3412290027693;;;https://www.carrefour.fr/p/beurre-demi-sel-paysan-breton-3412290027693?t=36993
Camembert PAYSAN BRETON;2,35 €;9.40 € / KG;3218930521008;U;;https://www.carrefour.fr/p/camembert-paysan-breton-3218930521008?t=36993
Crème Fraîche Epaisse Onctueuse Et Douce 30% Mat.Gr. PAYSAN BRETON;2,85 €;6.46 € / L;3412290001822;U;;https://www.carrefour.fr/p/creme-fraiche-epaisse-onctueuse-et-douce-30-mat-gr-paysan-breton-3412290001822?t=36993
Emmental PAYSAN BRETON;3,99 €;11.40 € / KG;3412290023442;U;;https://www.carrefour.fr/p/emmental-paysan-breton-3412290023442?t=36993
Fromage Râpé Emmental PAYSAN BRETON;1,96 €;9.80 € / KG;3184030003488;U;;https://www.carrefour.fr/p/fromage-rape-emmental-paysan-breton-3184030003488?t=36993
Fromage Fouetté Madame Loïk Echalote Ciboulette PAYSAN BRETON;1,79 €;11.93 € / KG;3236240070405;;;https://www.carrefour.fr/p/fromage-fouette-madame-loik-echalote-ciboulette-paysan-breton-3236240070405?t=36993
Fromage Râpé Emmental PAYSAN BRETON;1,79 €;11.93 € / KG;3412290023909;U;;https://www.carrefour.fr/p/fromage-rape-emmental-paysan-breton-3412290023909?t=36993
Fromage Fouetté Madame Loïk Nature au Sel de Guérande PAYSAN BRETON;2,25 €;12.50 € / KG;3412290070064;;;https://www.carrefour.fr/p/fromage-fouette-madame-loik-nature-au-sel-de-guerande-paysan-breton-3412290070064?t=36993
Fromage Fouetté Madame Loïk Nature au Sel de Guérande PAYSAN BRETON;3,19 €;9.97 € / KG;3412290070071;;;https://www.carrefour.fr/p/fromage-fouette-madame-loik-nature-au-sel-de-guerande-paysan-breton-3412290070071?t=36993
Fromage Fouetté Madame Loïk Nature au sel de Guérande PAYSAN BRETON;4,45 €;9.67 € / KG;3412290070088;;;https://www.carrefour.fr/p/fromage-fouette-madame-loik-nature-au-sel-de-guerande-paysan-breton-3412290070088?t=36993
Fromage Fouetté Madame Loïk Nature au sel de Guérande PAYSAN BRETON;1,99 €;11.06 € / KG;3412290070101;;;https://www.carrefour.fr/p/fromage-fouette-madame-loik-nature-au-sel-de-guerande-paysan-breton-3412290070101?t=36993
Fromage Fouetté Madame Loïk Nature au Sel de Guérande au Sel Réduit de -25% PAYSAN BRETON;1,79 €;11.93 € / KG;3412290070385;;;https://www.carrefour.fr/p/fromage-fouette-madame-loik-nature-au-sel-de-guerande-au-sel-reduit-de-25-paysan-breton-3412290070385?t=36993
Fromage à Tartiner Ail Et Fines Herbes Madame Loïk PAYSAN BRETON;3,09 €;11.24 € / KG;3412290070583;;;https://www.carrefour.fr/p/fromage-a-tartiner-ail-et-fines-herbes-madame-loik-paysan-breton-3412290070583?t=36993
Fromage Fouetté Ail & Fines Herbes Madame Loïk PAYSAN BRETON;1,69 €;11.27 € / KG;3412290070859;;Ouvrir description de la promotion 1 acheté = 15% de remise;https://www.carrefour.fr/p/fromage-fouette-ail-fines-herbes-madame-loik-paysan-breton-3412290070859?t=36993
Fromage Fouetté Madame Loïk Ail et Fines Herbes PAYSAN BRETON;1,75 €;11.67 € / KG;3412290071801;;;https://www.carrefour.fr/p/fromage-fouette-madame-loik-ail-et-fines-herbes-paysan-breton-3412290071801?t=36993
Fromage Fouetté Madame Loïk Figue Noix PAYSAN BRETON;1,59 €;10.60 € / KG;3412290071870;;;https://www.carrefour.fr/p/fromage-fouette-madame-loik-figue-noix-paysan-breton-3412290071870?t=36993
Lait Fermenté Ribot PAYSAN BRETON;1,85 €;1.83 € / L;3218930156002;C;;https://www.carrefour.fr/p/lait-fermente-ribot-paysan-breton-3218930156002?t=36993
Lait Ribot PAYSAN BRETON;1,39 €;2.78 € / L;3218930167008;;;https://www.carrefour.fr/p/lait-ribot-paysan-breton-3218930167008?t=36993
Lait Fermenté PAYSAN BRETON;2,39 €;2.39 € / L;3412290001372;;;https://www.carrefour.fr/p/lait-fermente-paysan-breton-3412290001372?t=36993
Œuf plein air PAYSAN BRETON;3,39 €;0.28 € / U;3760224690018;A;;https://www.carrefour.fr/p/oeuf-plein-air-paysan-breton-3760224690018?t=36993
Œufs plein air PAYSAN BRETON;1,75 €;0.29 € / U;3760224690001;U;;https://www.carrefour.fr/p/oeufs-plein-air-paysan-breton-3760224690001?t=36993
Œufs Bio PAYSAN BRETON;3,15 €;0.52 € / U;3760224690070;;;https://www.carrefour.fr/p/oeufs-bio-paysan-breton-3760224690070?t=36993
Œufs Bio PAYSAN BRETON;4,99 €;0.50 € / U;3760224690131;;;https://www.carrefour.fr/p/oeufs-bio-paysan-breton-3760224690131?t=36993
Petits Beurre Doux PAYSAN BRETON;3,29 €;16.45 € / KG;3412290011098;;;https://www.carrefour.fr/p/petits-beurre-doux-paysan-breton-3412290011098?t=36993
Oeufs plein air PAYS D'YVELINE;2,50 €;0.42 € / U;3414280000068;A;;https://www.carrefour.fr/p/oeufs-plein-air-pays-d-yveline-3414280000068?t=36993
Oeufs plein air PAYS D'YVELINE;4,79 €;0.40 € / U;3414280000129;A;;https://www.carrefour.fr/p/oeufs-plein-air-pays-d-yveline-3414280000129?t=36993
Oeufs Bio PAYS D'YVELINE;5,99 €;0.60 € / U;3700864011101;A;;https://www.carrefour.fr/p/oeufs-bio-pays-d-yveline-3700864011101?t=36993
Oeufs frais PAYS D'YVELINE;3,99 €;0.33 € / U;3700864011125;A;;https://www.carrefour.fr/p/oeufs-frais-pays-d-yveline-3700864011125?t=36993
Oeufs production locale PAYS D'YVELINE;2,19 €;0.36 € / U;3700864025061;A;;https://www.carrefour.fr/p/oeufs-production-locale-pays-d-yveline-3700864025061?t=36993
Oeufs Bio PAYS D'YVELINE;4,00 €;0.67 € / U;3700864026068;A;;https://www.carrefour.fr/p/oeufs-bio-pays-d-yveline-3700864026068?t=36993
Fromage Fouetté Madame Loïk au Lait de Vache et Chèvre PAYSON BRETON;1,79 €;11.93 € / KG;3236240071952;;Ouvrir description de la promotion 1 acheté = 10% de remise;https://www.carrefour.fr/p/fromage-fouette-madame-loik-au-lait-de-vache-et-chevre-payson-breton-3236240071952?t=36993
Crème dessert chocolat Bio PECHALOU;2,40 €;5.45 € / KG;3339526073005;C;;https://www.carrefour.fr/p/creme-dessert-chocolat-bio-pechalou-3339526073005?t=36993
Crème dessert de brebis chocolat Bio PECHALOU;2,35 €;11.75 € / KG;3339526073012;B;;https://www.carrefour.fr/p/creme-dessert-de-brebis-chocolat-bio-pechalou-3339526073012?t=36993
Crème dessert de brebis café Bio PECHALOU;2,35 €;11.75 € / KG;3339526073029;B;;https://www.carrefour.fr/p/creme-dessert-de-brebis-cafe-bio-pechalou-3339526073029?t=36993
Yaourt nature PECHALOU;2,49 €;3.32 € / KG;3339520000045;B;;https://www.carrefour.fr/p/yaourt-nature-pechalou-3339520000045?t=36993
Yaourt mangue brassé PECHALOU;2,55 €;5.10 € / KG;3339526062153;B;;https://www.carrefour.fr/p/yaourt-mangue-brasse-pechalou-3339526062153?t=36993
Yaourt de brebis nature Bio PECHALOU;2,99 €;7.48 € / KG;3339526072107;A;;https://www.carrefour.fr/p/yaourt-de-brebis-nature-bio-pechalou-3339526072107?t=36993
Yaourts abricot PECHALOU;2,55 €;5.10 € / KG;3339520014332;U;;https://www.carrefour.fr/p/yaourts-abricot-pechalou-3339520014332?t=36993
Yaourts noix de coco PECHALOU;2,29 €;4.58 € / KG;3339520045183;C;;https://www.carrefour.fr/p/yaourts-noix-de-coco-pechalou-3339520045183?t=36993
Yaourts pêche du Roussillon PECHALOU;2,55 €;5.10 € / KG;3339520046067;U;;https://www.carrefour.fr/p/yaourts-peche-du-roussillon-pechalou-3339520046067?t=36993
Yaourts au Lait Entier Brassé à la Myrtille PECHALOU;2,55 €;5.10 € / KG;3339520046401;B;;https://www.carrefour.fr/p/yaourts-au-lait-entier-brasse-a-la-myrtille-pechalou-3339520046401?t=36993
Yaourts fraise de Dordogne PECHALOU;2,55 €;5.10 € / KG;3339520092651;U;;https://www.carrefour.fr/p/yaourts-fraise-de-dordogne-pechalou-3339520092651?t=36993
Yaourts framboise PECHALOU;2,10 €;4.20 € / KG;3339520463208;U;;https://www.carrefour.fr/p/yaourts-framboise-pechalou-3339520463208?t=36993
Yaourts café caramel PECHALOU;2,49 €;4.98 € / KG;3339526061019;C;;https://www.carrefour.fr/p/yaourts-cafe-caramel-pechalou-3339526061019?t=36993
Yaourts brassé fruits PECHALOU;3,00 €;4.00 € / KG;3339526062009;C;;https://www.carrefour.fr/p/yaourts-brasse-fruits-pechalou-3339526062009?t=36993
Yaourts au Lait Entier Brassé à la Châtaigne PECHALOU;2,55 €;5.10 € / KG;3339526062238;B;;https://www.carrefour.fr/p/yaourts-au-lait-entier-brasse-a-la-chataigne-pechalou-3339526062238?t=36993
Yaourts citron Bio PECHALOU;2,45 €;4.90 € / KG;3339526071018;C;;https://www.carrefour.fr/p/yaourts-citron-bio-pechalou-3339526071018?t=36993
Yaourts vanille Bio PECHALOU;2,55 €;5.10 € / KG;3339526071025;C;;https://www.carrefour.fr/p/yaourts-vanille-bio-pechalou-3339526071025?t=36993
Yaourts café Bio PECHALOU;2,49 €;4.98 € / KG;3339526071094;C;;https://www.carrefour.fr/p/yaourts-cafe-bio-pechalou-3339526071094?t=36993
Yaourts nature Bio PECHALOU;2,29 €;4.58 € / KG;3339526072008;C;;https://www.carrefour.fr/p/yaourts-nature-bio-pechalou-3339526072008?t=36993
Yaourts nature brassé bio PECHALOU;1,85 €;5.29 € / KG;3339526072022;U;;https://www.carrefour.fr/p/yaourts-nature-brasse-bio-pechalou-3339526072022?t=36993
Fromage de Chèvre Au Lait Cru AOP PELARDON;10,89 €;30.25 € / KG;3303320000413;U;;https://www.carrefour.fr/p/fromage-de-chevre-au-lait-cru-aop-pelardon-3303320000413?t=36993
Fromage de Chèvre AOP PELARDON;4,39 €;36.58 € / KG;3303320000611;U;;https://www.carrefour.fr/p/fromage-de-chevre-aop-pelardon-3303320000611?t=36993
Yaourt Entier Brassé à la Vanille PERLE DE LAIT;1,90 €;3.80 € / KG;3286151950082;B;;https://www.carrefour.fr/p/yaourt-entier-brasse-a-la-vanille-perle-de-lait-3286151950082?t=36993
Yaourts fruits jaunes pêche mangue brassé PERLE DE LAIT;1,99 €;3.98 € / KG;3329770083721;C;;https://www.carrefour.fr/p/yaourts-fruits-jaunes-peche-mangue-brasse-perle-de-lait-3329770083721?t=36993
Yaourt aromatisé sur lit de framboise PERLE DE LAIT YOPLAIT;2,39 €;4.78 € / KG;3329770065871;C;;https://www.carrefour.fr/p/yaourt-aromatise-sur-lit-de-framboise-perle-de-lait-yoplait-3329770065871?t=36993
Yaourt aromatisé sur lit de mangue passion PERLE DE LAIT YOPLAIT;2,39 €;4.78 € / KG;3329770065895;C;;https://www.carrefour.fr/p/yaourt-aromatise-sur-lit-de-mangue-passion-perle-de-lait-yoplait-3329770065895?t=36993
Yaourt aromatisé sur lit de crème de marron PERLE DE LAIT YOPLAIT;2,39 €;4.78 € / KG;3329770065901;C;;https://www.carrefour.fr/p/yaourt-aromatise-sur-lit-de-creme-de-marron-perle-de-lait-yoplait-3329770065901?t=36993
Yaourt aromatisé sur lit de caramel PERLE DE LAIT YOPLAIT;2,39 €;4.78 € / KG;3329770065918;C;;https://www.carrefour.fr/p/yaourt-aromatise-sur-lit-de-caramel-perle-de-lait-yoplait-3329770065918?t=36993
Yaourt aromatisé sur lit de fraise pêche mangue passion framboise PERLE DE LAIT YOPLAIT;3,89 €;3.89 € / KG;3329770079243;C;;https://www.carrefour.fr/p/yaourt-aromatise-sur-lit-de-fraise-peche-mangue-passion-framboise-perle-de-lait-yoplait-3329770079243?t=36993
Yaourt brassé saveur amande PERLE DE LAIT YOPLAIT;1,99 €;3.98 € / KG;3329770065314;C;;https://www.carrefour.fr/p/yaourt-brasse-saveur-amande-perle-de-lait-yoplait-3329770065314?t=36993
Yaourt brassé coco PERLE DE LAIT YOPLAIT;3,75 €;3.75 € / KG;3329770065369;C;;https://www.carrefour.fr/p/yaourt-brasse-coco-perle-de-lait-yoplait-3329770065369?t=36993
Yaourt brassé citron PERLE DE LAIT YOPLAIT;3,75 €;3.75 € / KG;3329770065376;C;;https://www.carrefour.fr/p/yaourt-brasse-citron-perle-de-lait-yoplait-3329770065376?t=36993
Yaourt brassé vanille PERLE DE LAIT YOPLAIT;3,75 €;3.75 € / KG;3329770065963;C;;https://www.carrefour.fr/p/yaourt-brasse-vanille-perle-de-lait-yoplait-3329770065963?t=36993
Yaourt brassé vanille citron coco amande PERLE DE LAIT YOPLAIT;3,75 €;3.75 € / KG;3329770075092;C;;https://www.carrefour.fr/p/yaourt-brasse-vanille-citron-coco-amande-perle-de-lait-yoplait-3329770075092?t=36993
Yaourt brassé nature PERLE DE LAIT YOPLAIT;3,39 €;3.39 € / KG;3329770080102;C;;https://www.carrefour.fr/p/yaourt-brasse-nature-perle-de-lait-yoplait-3329770080102?t=36993
Yaourt brassé nature PERLE DE LAIT YOPLAIT;1,79 €;3.58 € / KG;3329770080119;C;;https://www.carrefour.fr/p/yaourt-brasse-nature-perle-de-lait-yoplait-3329770080119?t=36993
Yaourt brassé coco PERLE DE LAIT YOPLAIT;1,99 €;3.98 € / KG;3329770080126;C;;https://www.carrefour.fr/p/yaourt-brasse-coco-perle-de-lait-yoplait-3329770080126?t=36993
Yaourt brassé citron PERLE DE LAIT YOPLAIT;1,99 €;3.98 € / KG;3329770080133;C;;https://www.carrefour.fr/p/yaourt-brasse-citron-perle-de-lait-yoplait-3329770080133?t=36993
Yaourt brassé vanille PERLE DE LAIT YOPLAIT;1,99 €;3.98 € / KG;3329770080140;C;;https://www.carrefour.fr/p/yaourt-brasse-vanille-perle-de-lait-yoplait-3329770080140?t=36993
Yaourt brassé framboise fruits rouges PERLE DE LAIT YOPLAIT;1,99 €;3.98 € / KG;3329770083738;C;;https://www.carrefour.fr/p/yaourt-brasse-framboise-fruits-rouges-perle-de-lait-yoplait-3329770083738?t=36993
Fromage de Chèvre Frais PETIT BILLY;2,69 €;13.45 € / KG;3273220012123;;;https://www.carrefour.fr/p/fromage-de-chevre-frais-petit-billy-3273220012123?t=36993
Fromage de Chèvre Frais l'Onctueux Figue et Oignon PETIT BILLY;2,65 €;20.38 € / KG;3273221117759;;;https://www.carrefour.fr/p/fromage-de-chevre-frais-l-onctueux-figue-et-oignon-petit-billy-3273221117759?t=36993
Crème Fraîche Fleurette Entière 30% M.G PETITE FRANCE;2,39 €;6.83 € / KG;3262970703061;;;https://www.carrefour.fr/p/creme-fraiche-fleurette-entiere-30-m-g-petite-france-3262970703061?t=36993
Créme fraiche Épaisse 15% de Matière grasse PETITE FRANCE;1,75 €;3.50 € / L;3262970703108;;;https://www.carrefour.fr/p/creme-fraiche-epaisse-15-de-matiere-grasse-petite-france-3262970703108?t=36993
Créme fraiche Épaisse 30% de Matière grasse PETITE FRANCE;2,15 €;4.30 € / L;3262970703115;;;https://www.carrefour.fr/p/creme-fraiche-epaisse-30-de-matiere-grasse-petite-france-3262970703115?t=36993
Cossettes de Mozzarella PETIT MARCHE;1,95 €;13.00 € / KG;3060921454525;;;https://www.carrefour.fr/p/cossettes-de-mozzarella-petit-marche-3060921454525?t=36993
Dés Mimolette PETIT MARCHE;2,60 €;21.67 € / KG;3060921463275;D;;https://www.carrefour.fr/p/des-mimolette-petit-marche-3060921463275?t=36993
Dés Fromage Méditérannéen PETIT MARCHE;2,80 €;23.33 € / KG;3060921505050;D;;https://www.carrefour.fr/p/des-fromage-mediteranneen-petit-marche-3060921505050?t=36993
Dés Cheddar Fumé PETIT MARCHE;2,70 €;22.50 € / KG;3060921508136;;;https://www.carrefour.fr/p/des-cheddar-fume-petit-marche-3060921508136?t=36993
Dés de fromage de chèvre PETIT MARCHE;3,35 €;27.92 € / KG;3060921462537;D;;https://www.carrefour.fr/p/des-de-fromage-de-chevre-petit-marche-3060921462537?t=36993
Dés Fromage Basilic PETIT MARCHE;2,75 €;22.92 € / KG;3060921462513;D;;https://www.carrefour.fr/p/des-fromage-basilic-petit-marche-3060921462513?t=36993
Fromage Dés aux noix PETIT MARCHE;2,60 €;21.67 € / KG;3060921462520;D;;https://www.carrefour.fr/p/fromage-des-aux-noix-petit-marche-3060921462520?t=36993
Fromage Dés d'emmental PETIT MARCHE;2,75 €;22.92 € / KG;3060921462544;D;;https://www.carrefour.fr/p/fromage-des-d-emmental-petit-marche-3060921462544?t=36993
Fromage Gouda en dés au cumin PETIT MARCHE;2,45 €;20.42 € / KG;3060921462551;D;;https://www.carrefour.fr/p/fromage-gouda-en-des-au-cumin-petit-marche-3060921462551?t=36993
Fromage Mimolette Gouda en dés PETIT MARCHE;2,45 €;20.42 € / KG;3060921462568;D;;https://www.carrefour.fr/p/fromage-mimolette-gouda-en-des-petit-marche-3060921462568?t=36993
Fromage Cheddar en dés PETIT MARCHE;2,55 €;21.25 € / KG;3060921505296;D;;https://www.carrefour.fr/p/fromage-cheddar-en-des-petit-marche-3060921505296?t=36993
Plateau de Fromage en dès Mimolette, Meule du Besac, Emmental Français, Chèvre PETIT MARCHE;6,25 €;22.32 € / KG;3060921454686;;;https://www.carrefour.fr/p/plateau-de-fromage-en-des-mimolette-meule-du-besac-emmental-francais-chevre-petit-marche-3060921454686?t=36993
Râpé de Cheddar PETIT MARCHE;2,45 €;16.33 € / KG;3060921506682;;;https://www.carrefour.fr/p/rape-de-cheddar-petit-marche-3060921506682?t=36993
Trio Dés Fromage de Chèvre, Emmental et Chorizo PETIT MARCHE;4,25 €;28.33 € / KG;3060921507467;;;https://www.carrefour.fr/p/trio-des-fromage-de-chevre-emmental-et-chorizo-petit-marche-3060921507467?t=36993
Trio Dés Mimolette, Gauda et Saucisson PETIT MARCHE;3,95 €;26.33 € / KG;3060921507498;;;https://www.carrefour.fr/p/trio-des-mimolette-gauda-et-saucisson-petit-marche-3060921507498?t=36993
Camembert au lait cru PETIT NORMAND;3,65 €;14.60 € / KG;3267031060640;D;;https://www.carrefour.fr/p/camembert-au-lait-cru-petit-normand-3267031060640?t=36993
Yaourt enfant à boire tubs aromatisé fraise framboise pêche PETITS FILOUS;3,59 €;6.47 € / KG;3329770080041;B;;https://www.carrefour.fr/p/yaourt-enfant-a-boire-tubs-aromatise-fraise-framboise-peche-petits-filous-3329770080041?t=36993
Yaourt enfant à boire petit-suisse aromatisé vanille PETITS FILOUS;2,99 €;4.98 € / KG;3329770063020;B;;https://www.carrefour.fr/p/yaourt-enfant-a-boire-petit-suisse-aromatise-vanille-petits-filous-3329770063020?t=36993
Yaourt enfant à boire petit-suisse aromatisé fraise PETITS FILOUS;2,99 €;4.98 € / KG;3329770063037;B;;https://www.carrefour.fr/p/yaourt-enfant-a-boire-petit-suisse-aromatise-fraise-petits-filous-3329770063037?t=36993
Yaourt enfant petit-suisse au chocolat PETITS FILOUS;2,19 €;3.65 € / KG;3176572555280;C;;https://www.carrefour.fr/p/yaourt-enfant-petit-suisse-au-chocolat-petits-filous-3176572555280?t=36993
Yaourt enfant petit-suisse aux fruits mixés panaché PETITS FILOUS;2,55 €;4.25 € / KG;3329770058897;B;;https://www.carrefour.fr/p/yaourt-enfant-petit-suisse-aux-fruits-mixes-panache-petits-filous-3329770058897?t=36993
Yaourt enfant petit-suisse aux fruits mixés panaché PETITS FILOUS;2,85 €;3.17 € / KG;3329770058903;B;;https://www.carrefour.fr/p/yaourt-enfant-petit-suisse-aux-fruits-mixes-panache-petits-filous-3329770058903?t=36993
Fromage Blanc Petit-Suisse Nature 0% MG PETIT YOPLAIT;2,39 €;3.32 € / KG;3329770051065;A;;https://www.carrefour.fr/p/fromage-blanc-petit-suisse-nature-0-mg-petit-yoplait-3329770051065?t=36993
Fromage Blanc Petit-Suisse Nature 3,8% MG PETIT YOPLAIT;1,39 €;3.86 € / KG;3329770051072;A;;https://www.carrefour.fr/p/fromage-blanc-petit-suisse-nature-3-8-mg-petit-yoplait-3329770051072?t=36993
Fromage Blanc Petit-Suisse Nature 0% MG PETIT YOPLAIT;1,75 €;4.86 € / KG;3329770051089;A;;https://www.carrefour.fr/p/fromage-blanc-petit-suisse-nature-0-mg-petit-yoplait-3329770051089?t=36993
Fromage Blanc Petit-Suisse Nature 3,8% MG PETIT YOPLAIT;1,99 €;2.76 € / KG;3329770051096;A;;https://www.carrefour.fr/p/fromage-blanc-petit-suisse-nature-3-8-mg-petit-yoplait-3329770051096?t=36993
Cheesecake PHILADELPHIA;3,65 €;22.81 € / KG;5412949097808;U;;https://www.carrefour.fr/p/cheesecake-philadelphia-5412949097808?t=36993
Cheesecake Nature et Biscuit Spéculoos PHILADELPHIA;2,65 €;33.12 € / KG;5412949097815;;Ouvrir description de la promotion Le 2ème à -50%;https://www.carrefour.fr/p/cheesecake-nature-et-biscuit-speculoos-philadelphia-5412949097815?t=36993
Fromage à Tartiner Nature PHILADELPHIA;4,49 €;8.98 € / KG;7622210696700;D;;https://www.carrefour.fr/p/fromage-a-tartiner-nature-philadelphia-7622210696700?t=36993
Fromage à Tartiner Nature PHILADELPHIA;1,81 €;12.07 € / KG;7622210747877;;Ouvrir description de la promotion PROMO : 30%;https://www.carrefour.fr/p/fromage-a-tartiner-nature-philadelphia-7622210747877?t=36993
Fromage à Tartiner Nature PHILADELPHIA;1,79 €;11.93 € / KG;7622300441937;;;https://www.carrefour.fr/p/fromage-a-tartiner-nature-philadelphia-7622300441937?t=36993
Fromage à Tartiner Nature PHILADELPHIA;2,79 €;9.30 € / KG;7622300685782;D;;https://www.carrefour.fr/p/fromage-a-tartiner-nature-philadelphia-7622300685782?t=36993
Fromage à Tartiner Light Nature PHILADELPHIA;2,15 €;14.33 € / KG;7622300719302;;;https://www.carrefour.fr/p/fromage-a-tartiner-light-nature-philadelphia-7622300719302?t=36993
Fromage Le Rond au lait entier de chèvre PICANDINE;2,95 €;29.50 € / KG;3305510065431;;;https://www.carrefour.fr/p/fromage-le-rond-au-lait-entier-de-chevre-picandine-3305510065431?t=36993
Fromage cabécou chèvre au lait pasteurisé PICANDINE;2,95 €;28.10 € / KG;3305510066094;U;;https://www.carrefour.fr/p/fromage-cabecou-chevre-au-lait-pasteurise-picandine-3305510066094?t=36993
Fromage au lait de brebis PIERUCCI;11,75 €;33.57 € / KG;3760025680058;U;;https://www.carrefour.fr/p/fromage-au-lait-de-brebis-pierucci-3760025680058?t=36993
Faisselle de chèvre P. JACQUIN & FILS;3,70 €;7.40 € / KG;3369640014400;U;;https://www.carrefour.fr/p/faisselle-de-chevre-p-jacquin-fils-3369640014400?t=36993
Fromage de Chèvre Selles-sur-Cher AOP P.JACQUIN & FILS;3,90 €;26.00 € / KG;3369640017746;;;https://www.carrefour.fr/p/fromage-de-chevre-selles-sur-cher-aop-p-jacquin-fils-3369640017746?t=36993
Fromage de Chèvre Sainte Maure de Touraine AOP P.JACQUIN & FILS;5,90 €;23.60 € / KG;3369640017753;;;https://www.carrefour.fr/p/fromage-de-chevre-sainte-maure-de-touraine-aop-p-jacquin-fils-3369640017753?t=36993
Margarine liquide cuisson pratique PLANTA FIN;2,69 €;5.38 € / L;8719200056626;;;https://www.carrefour.fr/p/margarine-liquide-cuisson-pratique-planta-fin-8719200056626?t=36993
Margarine doux sans huile de palme PLANTA FIN;5,25 €;5.83 € / KG;8719200250086;;;https://www.carrefour.fr/p/margarine-doux-sans-huile-de-palme-planta-fin-8719200250086?t=36993
